,id,subreddit,query,sort,date,title,author,stickied,upvote_ratio,score,url,num_comments,created,body
0,12whu0c,artificial,Open-AI,top,2023-04-23 16:50:32,"ChatGPT costs OpenAI $700,000 a day to keep it running",jaketocake,False,0.95,454,https://futurism.com/the-byte/chatgpt-costs-openai-every-day,108,1682268632.0,
1,108ssxs,artificial,Open-AI,top,2023-01-11 02:23:24,Trump describing the banana eating experience - OpenAI ChatGPT,turkeyfinster,False,0.93,381,https://i.redd.it/llqzdb30rbba1.png,28,1673403804.0,
2,11g5qxm,artificial,Open-AI,top,2023-03-02 15:38:18,An open-source AI tool called FAL Detector has been used to analyze how celebrities' faces are photoshopped on magazine covers.,Dalembert,False,0.96,264,https://www.reddit.com/gallery/11g5g3c,29,1677771498.0,
3,11u3l9h,artificial,Open-AI,top,2023-03-17 20:59:09,"Elon on how OpenAI , a non-profit he donated $100M somehow became a $30B market cap for-profit company",GamesAndGlasses,False,0.93,260,https://i.redd.it/60vyecp4uxna1.png,71,1679086749.0,
4,zu0m74,artificial,Open-AI,top,2022-12-24 03:30:21,Companies offering AI products.,Notalabel_4566,False,0.97,221,https://i.redd.it/6p1yxdbrxn7a1.jpg,29,1671852621.0,
5,11b0i1j,artificial,Open-AI,top,2023-02-24 20:00:25,That's getting interesting - LLaMA,Linkology,False,0.94,199,https://i.redd.it/riesfstch8ka1.jpg,32,1677268825.0,
6,10877uc,artificial,Open-AI,top,2023-01-10 11:07:55,Microsoft Will Likely Invest $10 billion for 49 Percent Stake in OpenAI,BackgroundResult,False,0.98,199,https://aisupremacy.substack.com/p/microsoft-will-likely-invest-10-billion,60,1673348875.0,
7,12cczbg,artificial,Open-AI,top,2023-04-05 08:11:16,“Building a kind of JARVIS @ OpenAI” - Karpathy’s Twitter,jaketocake,False,0.95,180,https://i.redd.it/hp5nf0maf2sa1.jpg,9,1680682276.0,
8,zc2r6m,artificial,Open-AI,top,2022-12-04 06:40:32,Struggling to write a solid bio? Why not let OpenAI handle it?,exstaticj,False,0.98,171,https://i.imgur.com/QIXe08M.jpg,12,1670136032.0,
9,12yqvi5,artificial,Open-AI,top,2023-04-25 17:59:55,OpenAI announces new ways to manage your data in ChatGPT,chris-mckay,False,0.99,149,https://openai.com/blog/new-ways-to-manage-your-data-in-chatgpt,30,1682445595.0,
10,126u08d,artificial,Open-AI,top,2023-03-30 17:42:53,"[LAION launches a petition to democratize AI research by establishing an international, publicly funded supercomputing facility equipped with 100,000 state-of-the-art AI accelerators to train open source foundation models.",acutelychronicpanic,False,0.96,148,https://www.openpetition.eu/petition/online/securing-our-digital-future-a-cern-for-open-source-large-scale-ai-research-and-its-safety,7,1680198173.0,
11,11bnjio,artificial,Open-AI,top,2023-02-25 15:25:39,"Famous ChatBot tech Company, OpenAI Hired 93 Ex-Employees from Meta and Google",shubhamorcapex,False,0.9,134,https://thebuzz.news/article/famous-chatbot-tech-company-openai-hired/3704/,17,1677338739.0,
12,12qv5y0,artificial,Open-AI,top,2023-04-18 16:36:12,Is it my imagination or are 90% of the new API tools just custom queries you could do manually with chatgpt ?,punkouter23,False,0.95,116,https://www.reddit.com/r/artificial/comments/12qv5y0/is_it_my_imagination_or_are_90_of_the_new_api/,46,1681835772.0,"Like this

 [Genie - #1 AI Chatbot - ChatGPT App (usegenie.ai)](https://www.usegenie.ai/) 

I got it.. and after awhile I feel like I could just goto the openai website and do the same thing...  It allows you to upload images and describes them.. but that is also a very common feature everywhere. 

So the list I would really like is 'New AI tools that cannot be done with a openAI prompt'"
13,136d30p,artificial,Open-AI,top,2023-05-03 07:01:33,"Kamala Harris discusses A.I. in meeting with Google, Microsoft, OpenAI and Anthropic CEOs",jaketocake,False,0.86,113,https://www.cnbc.com/2023/05/02/kamala-harris-to-hold-ai-meeting-with-google-microsoft-and-openai.html,70,1683097293.0,
14,z8r20d,artificial,Open-AI,top,2022-11-30 13:07:30,"Short excerpt from my latest, 7min long ai video using mixed techniques, made for my song Jean's Memory, about dementia. Using the instability of the frames to represented the fragmentation of a mind. Link to the full video in comments. Open to questions about the process.",defensiveFruit,False,0.92,112,https://v.redd.it/4gr16qkr733a1,24,1669813650.0,
15,10894cf,artificial,Open-AI,top,2023-01-10 12:53:37,Some Ultra-Modern Generative Ai,Imagine-your-success,False,0.96,106,https://i.redd.it/xdtdtuolq7ba1.png,13,1673355217.0,
16,zzn4xs,artificial,Open-AI,top,2022-12-31 06:07:42,"Wang released an open-source implementation of ChatGPT, LAION & CasperAI are now training their own (to be launched soon)",lambolifeofficial,False,0.98,100,https://metaroids.com/news/an-open-source-version-of-chatgpt-is-coming/,7,1672466862.0,
17,zwd1s1,artificial,Open-AI,top,2022-12-27 10:57:42,What are your thoughts on Generative AI?,According_Complex_74,False,0.92,81,https://www.reddit.com/r/artificial/comments/zwd1s1/what_are_your_thoughts_on_generative_ai/,62,1672138662.0,"I recently [read this article](https://jina.ai/news/search-is-overfitted-create-create-is-underfitted-search/) and thought of using ChatGPT. I've been chatting with ChatGPT all week, bouncing ideas off of it to get it to help me flesh out my thoughts.

I found out that these technologies are iterative. One is built on top of the last one, and each new iteration is more powerful and increases the potential for discovery in some exponential way. It's like a whole new level for these machines to grow and improve, and it's opening up all kinds of possibilities for what we might find out. Also, something like this has been going on for a while now like (JasperAI, CopyAI, Copysmith… the list goes on… maybe Google is even going to join the bandwagon with Google Assistant? Who knows).

These technologies are also seriously disruptive, like we've never seen before. If you don't believe me, just spend a week chatting with ChatGPT or something similar and see for yourself. It’s obvious that these tools (yes tools) are going to be like a boost to our own creative skills, not to take over or anything, just to make them even better.

So for those creative workers out there like copywriters, graphic designers and web designers, instead of worrying that you might get replaced, you can instead use this technology to your own advantage. You can use it for ideas for blog topics. You can also use it for design ideas and templates for your graphics and website. And that’s just the tip of the iceberg.

People are worried that these technologies might take the jobs of regular humans because they can help companies get stuff done with less people. But I think it's important to think about how these technologies are affecting us and to make sure they're used in a responsible and helpful way for everyone.

But AI is changing fast, so it's tough to say for sure how these technologies will play out in the future. We’ll see in 5-10 years at least how much AI will improve."
18,1096n10,artificial,Open-AI,top,2023-01-11 14:55:24,"World’s most powerful AI chatbot ChatGPT will soon ‘look like a boring toy’ says OpenAI boss | ""Sam Altman says ChatGPT will get ‘a lot better... fast’""",Tao_Dragon,False,0.96,78,https://www.independent.co.uk/tech/chatgpt-openai-agi-ai-chat-b2252002.html,38,1673448924.0,
19,126fg23,artificial,Open-AI,top,2023-03-30 07:22:24,"Train ChatGPT generate unlimited prompts for you. Prompt: You are GPT-4, OpenAI's advanced language model. Today, your job is to generate prompts for GPT-4. Can you generate the best prompts on ways to <what you want>",friuns,False,0.92,74,https://i.redd.it/yo5srhk7vtqa1.jpg,27,1680160944.0,
20,104uy1g,artificial,Open-AI,top,2023-01-06 14:02:08,OpenAI now thinks it's worth $30 Billion,BackgroundResult,False,0.86,71,https://datasciencelearningcenter.substack.com/p/openai-now-thinks-its-worth-30-billion,87,1673013728.0,
21,12b6ocu,artificial,Open-AI,comments,2023-04-04 02:34:31,AI will take your job,r0manlearns,False,0.45,0,https://www.reddit.com/r/artificial/comments/12b6ocu/ai_will_take_your_job/,174,1680575671.0,"Thinking AI cant take your job is copium, we have no idea what it will be able to do or when, but whatever comes will likely be able to figure out your job. It might create new jobs, it might open up our understanding to new concepts that require an even further level of contextual complexity necessary for humans to do, it might kill us all idk. We are tools under an economic perspective that if replaceable, will be. None of the ""ah but it has problems with blah blah blah"", ""We still have no idea how an AI would overcome this blah blah blah"" matters. Im sorry, its cope. You dont know what limits can be passed or what unknown solutions will be brought forward. What we do know is your boss or clients would love nothing more than cheaper labor and the wealthy are throwing all of our life savings combined into making it happen."
22,12whu0c,artificial,Open-AI,comments,2023-04-23 16:50:32,"ChatGPT costs OpenAI $700,000 a day to keep it running",jaketocake,False,0.95,458,https://futurism.com/the-byte/chatgpt-costs-openai-every-day,108,1682268632.0,
23,104uy1g,artificial,Open-AI,comments,2023-01-06 14:02:08,OpenAI now thinks it's worth $30 Billion,BackgroundResult,False,0.86,74,https://datasciencelearningcenter.substack.com/p/openai-now-thinks-its-worth-30-billion,87,1673013728.0,
24,12m6y3b,artificial,Open-AI,comments,2023-04-14 18:15:28,Elon Musk plans artificial intelligence start-up to rival Open AI,SaintBiggusDickus,False,0.82,58,https://www.ft.com/content/2a96995b-c799-4281-8b60-b235e84aefe4,80,1681496128.0,
25,136d30p,artificial,Open-AI,comments,2023-05-03 07:01:33,"Kamala Harris discusses A.I. in meeting with Google, Microsoft, OpenAI and Anthropic CEOs",jaketocake,False,0.86,116,https://www.cnbc.com/2023/05/02/kamala-harris-to-hold-ai-meeting-with-google-microsoft-and-openai.html,70,1683097293.0,
26,11u3l9h,artificial,Open-AI,comments,2023-03-17 20:59:09,"Elon on how OpenAI , a non-profit he donated $100M somehow became a $30B market cap for-profit company",GamesAndGlasses,False,0.93,260,https://i.redd.it/60vyecp4uxna1.png,71,1679086749.0,
27,11vvddy,artificial,Open-AI,comments,2023-03-19 19:42:06,Just created a Fake PC Game as an April's Fool for my Friends with AI - and they are eagerly awaiting it now!,schitzN,False,0.87,29,https://www.reddit.com/r/artificial/comments/11vvddy/just_created_a_fake_pc_game_as_an_aprils_fool_for/,67,1679254926.0," **Short Summary:**

Currently convincing my friends to together start a new Game called Elysium, coming out on April 1st. This Game is pure Fake and does not exist. They are all in and are eager to explore the Worlds of a non existing Game!

[https://www.elysium-game.cloud/](https://www.elysium-game.cloud/)

**Long Background Story:**

So I played around with ChatGPT (v3.5) and tried to play games with it in the Chat. It did work partially, it created some rules for games on the fly and i also tried to visualize some sorts of Playing Fields as well. In parallel, I tried out the latest Midjourney (v5.0) and was really surprised by the results. So it suddenly hit me to create a Fake Game purely based on those two AI Tools.

I asked ChatGPT to create a title for an adventure game and the first answer was already perfect: ""Elysium: The Battle for the Mystical Realm"". I then asked to create some background story and description of the game if it where a Multiplayer Adventure Game for PC. A lot of great stuff came out and I immediately was on fire for more!

I opened up Midjourney and started to create images with prompts for a First-Person Adventure Game in Unreal Engine 5. With the new version 5.0 it was extremely easy to pump out some very satisfying images. The only thing I had to fix in Photoshop was the Text - as Midjourney 5.0 is still not capable of writing text.

With very convincing fake descriptions and fake screenshots of a game that does not exist, i decided to go full nuts and set up a chat with ChatGPT to build me a HTML Bootstrap webpage for Elysium and again, it worked extremely well. Due to the limitation of \~ 500 characters per post, I had to split the website in building blocks like the Jumbotron or the Gallery one by one but with a little bit of Web Development Background it was nearly no effort - more or less simple copy & paste and adapting the links to images and so on.

Within \~3 hours, I was able to create the whole Fake Game including Web Page with a Countdown and hosted it on some webspace. I was extremely satisfied with the result so I decided to invest EUR 3,- in a cheap domain name and redirected it to the webspace to make it even more convincing.

So I posted some pictures to some friends and also the link to the web page. They are all eagerly awaiting the launch of Elysium on April 1st. I fully convinced them with content 100% created by AI!

***The Website is unfortunately only in German!***

&#x200B;

[Fake Concept Art for a Fake Game](https://preview.redd.it/ewjd1ujg1roa1.png?width=1024&format=png&auto=webp&s=c88fbf18c640eb1381c18141b426a03ad3f01f0c)"
28,zwd1s1,artificial,Open-AI,comments,2022-12-27 10:57:42,What are your thoughts on Generative AI?,According_Complex_74,False,0.91,79,https://www.reddit.com/r/artificial/comments/zwd1s1/what_are_your_thoughts_on_generative_ai/,62,1672138662.0,"I recently [read this article](https://jina.ai/news/search-is-overfitted-create-create-is-underfitted-search/) and thought of using ChatGPT. I've been chatting with ChatGPT all week, bouncing ideas off of it to get it to help me flesh out my thoughts.

I found out that these technologies are iterative. One is built on top of the last one, and each new iteration is more powerful and increases the potential for discovery in some exponential way. It's like a whole new level for these machines to grow and improve, and it's opening up all kinds of possibilities for what we might find out. Also, something like this has been going on for a while now like (JasperAI, CopyAI, Copysmith… the list goes on… maybe Google is even going to join the bandwagon with Google Assistant? Who knows).

These technologies are also seriously disruptive, like we've never seen before. If you don't believe me, just spend a week chatting with ChatGPT or something similar and see for yourself. It’s obvious that these tools (yes tools) are going to be like a boost to our own creative skills, not to take over or anything, just to make them even better.

So for those creative workers out there like copywriters, graphic designers and web designers, instead of worrying that you might get replaced, you can instead use this technology to your own advantage. You can use it for ideas for blog topics. You can also use it for design ideas and templates for your graphics and website. And that’s just the tip of the iceberg.

People are worried that these technologies might take the jobs of regular humans because they can help companies get stuff done with less people. But I think it's important to think about how these technologies are affecting us and to make sure they're used in a responsible and helpful way for everyone.

But AI is changing fast, so it's tough to say for sure how these technologies will play out in the future. We’ll see in 5-10 years at least how much AI will improve."
29,10877uc,artificial,Open-AI,comments,2023-01-10 11:07:55,Microsoft Will Likely Invest $10 billion for 49 Percent Stake in OpenAI,BackgroundResult,False,0.98,201,https://aisupremacy.substack.com/p/microsoft-will-likely-invest-10-billion,60,1673348875.0,
30,z3j9pr,artificial,Open-AI,comments,2022-11-24 12:56:46,Are We Ready for AI-Generated Code?,ricks_cloud,False,0.89,69,https://www.reddit.com/r/artificial/comments/z3j9pr/are_we_ready_for_aigenerated_code/,59,1669294606.0,"I recently read an article regarding artificial intelligence-generated code. The quality of computer-generated visuals, such as portraits, pet shots, videos, essays, and works of art, has grown on us. GitHub Copilot, Tabnine, Polycode, and more tools have taken the next logical step by augmenting the present code autocomplete capability with #AI.

As a result, #artificial intelligence (AI) and #machine learning (ML) have been gradually introduced into software development. Unlike cat pictures, however, research shows that there is a real risk connected with the origin, quality, and security of application code.

Copilot's autocompletion, for example, is trained on open-source code to provide relevant snippets. This makes the quality and security of suggestions contingent on the training set. The greater concern is with AI-generated software code, not with Copilot. Similar generators are likely to gain popularity in the coming years. The computer industry must consider how such code is created, how it is used, and who is held accountable when things go wrong.

If you have any thoughts on the subject and believe it will benefit your organization, please share them with me.

  
[https://www.darkreading.com/edge-articles/ai-generated-code-is-coming-are-you-ready-](https://www.darkreading.com/edge-articles/ai-generated-code-is-coming-are-you-ready-)"
31,12sy9vi,artificial,Open-AI,comments,2023-04-20 13:14:25,Will we get a truly free and open source AI?,Aquillyne,False,0.81,17,https://www.reddit.com/r/artificial/comments/12sy9vi/will_we_get_a_truly_free_and_open_source_ai/,49,1681996465.0,"It bothers me a lot that these incredible developments are proprietary only.

Do you think we will ever get an LLM or image generator that is totally open and free, to run on your own hardware, that’s as good or better than the proprietary ones?"
32,12qv5y0,artificial,Open-AI,comments,2023-04-18 16:36:12,Is it my imagination or are 90% of the new API tools just custom queries you could do manually with chatgpt ?,punkouter23,False,0.95,118,https://www.reddit.com/r/artificial/comments/12qv5y0/is_it_my_imagination_or_are_90_of_the_new_api/,46,1681835772.0,"Like this

 [Genie - #1 AI Chatbot - ChatGPT App (usegenie.ai)](https://www.usegenie.ai/) 

I got it.. and after awhile I feel like I could just goto the openai website and do the same thing...  It allows you to upload images and describes them.. but that is also a very common feature everywhere. 

So the list I would really like is 'New AI tools that cannot be done with a openAI prompt'"
33,1345ay8,artificial,Open-AI,comments,2023-04-30 22:43:23,ChatGPT Leaks Reserved CVE Details: Should we be concerned?,hipsnitwitsmu3,False,0.63,40,https://www.reddit.com/r/artificial/comments/1345ay8/chatgpt_leaks_reserved_cve_details_should_we_be/,45,1682894603.0,"Hi all,

Blockfence recently uncovered potential security risks involving OpenAI's ChatGPT. They found undisclosed Common Vulnerabilities and Exposures (CVEs) from 2023 in the AI's responses. Intriguingly, when questioned, ChatGPT claimed to have ""invented"" the information about these undisclosed CVEs, which are currently marked as RESERVED.

The ""RESERVED"" status is key here because it means the vulnerabilities have been identified and a CVE number has been assigned, but the specifics are not yet public. Essentially, ChatGPT shared information that should not be publicly available yet, adding a layer of complexity to the issue of AI-generated content and data privacy.

This incident raises serious questions about AI's ethical boundaries and the need for transparency. OpenAI CEO, Sam Altman, has previously acknowledged issues with ChatGPT, including a bug that allowed users to access others' chat histories. Also, Samsung had an embarrassing ChatGPT leak recently, so this is a big concern.

As we grapple with these emerging concerns, how can we push for greater AI transparency and improve data security? Let's discuss.

Link to original thread: https://twitter.com/blockfence_io/status/1650247600606441472"
34,12691y3,artificial,Open-AI,comments,2023-03-30 02:43:30,A Rebuttal to the Call for a Six-Month Pause on AI Development: Stifling Progress is Not the Solution (GPT 4),aluode,False,0.77,22,https://www.reddit.com/r/artificial/comments/12691y3/a_rebuttal_to_the_call_for_a_sixmonth_pause_on_ai/,40,1680144210.0,"In a recent CBS News article, Michael Roppolo reported on an open letter signed by Elon Musk, Steve Wozniak, Andrew Yang, and over a thousand others, which calls for a six-month pause on AI development to address ""profound risks to society and humanity."" While the concerns raised by the signatories are valid, putting the brakes on AI development is not the most effective solution to the challenges we face.

First, it is essential to acknowledge the rapid advancements in AI, as exemplified by OpenAI's GPT-4. However, the development of powerful AI technologies has also resulted in substantial benefits across various industries, such as healthcare, transportation, and agriculture. By calling for a blanket pause on AI development, we risk stifling the progress that could lead to life-saving breakthroughs and more efficient systems.

Moreover, the pause fails to recognize that AI development is a global endeavor, and unilateral action by a group of concerned individuals is unlikely to have a significant impact on the pace of progress. Artificial intelligence research and development are being pursued by numerous organizations and countries worldwide, and a temporary halt in one area will only result in others pushing ahead.

Instead of attempting to halt AI development, we should advocate for a more collaborative approach to address the concerns raised by the signatories. By fostering an environment of cooperation and information-sharing among AI researchers, policymakers, and stakeholders, we can collectively develop best practices and ethical guidelines to mitigate potential risks.

One of the primary concerns highlighted in the open letter is the potential for AI systems like ChatGPT to be misused for spreading misinformation or generating ""grassroots"" letters to Congress. While these concerns are valid, the answer lies not in halting AI development, but in creating more robust detection and mitigation systems to counter malicious uses of the technology.

In addition, by working together with policymakers, researchers can help shape regulations that ensure AI is developed and deployed responsibly. This collaborative effort should focus on building AI systems that are accurate, safe, interpretable, transparent, robust, aligned, trustworthy, and loyal, as the open letter suggests.

In conclusion, a six-month pause on AI development might seem like a prudent step to address potential risks, but it ultimately stifles progress and innovation. Instead, we should strive for a more cooperative, proactive approach to tackle the challenges associated with AI development, ensuring that the benefits of this groundbreaking technology are realized while minimizing potential harm."
35,10k9ygc,artificial,Open-AI,comments,2023-01-24 16:52:21,"Why I Think Language Models Will Simulate ""Self Awareness"" More And More",TheRPGGamerMan,False,0.76,9,https://www.reddit.com/r/artificial/comments/10k9ygc/why_i_think_language_models_will_simulate_self/,38,1674579141.0,"The future of AI is getting really interesting, particularly with language models and generative AI.  But I think there is going to be a great deal of confusion in the near future about AI ethics with language models being ""self aware"" and having ""feelings"", particularly for average people who have little understanding of how these complex models work.  I think the problems will stem from the internet itself.  As I sit here writing a thread about AI having simulated ""self Awareness"" at some point in the future, a language model or AI will probably read this.

And this is what I mean, language models read and train on a great deal of text from the internet.  The more people discuss machine learning/language models/AGI, the greater understanding AI will have of it.  If GPT4 has more up to date training, it's going to know a great deal about GPT3, and if open AI create ways for the model to continue learning from real world events it will learn a great deal about itself, including false information.

Point is, massive language models like GPT are going to get harder to control.  It's impossible to filter everything it reads, so it's going to take in a lot of information about itself and other AI systems that may or may not be true.  It could cause some very strange behavior when it starts connecting the dots.  Just my thoughts.

Keep in mind, I am NOT saying language models will soon be sentient, I'm simply saying they are going to get better at convincing people that they are, and it might be hard to train that out of them, given all the false data out there that it will learn from."
36,1096n10,artificial,Open-AI,comments,2023-01-11 14:55:24,"World’s most powerful AI chatbot ChatGPT will soon ‘look like a boring toy’ says OpenAI boss | ""Sam Altman says ChatGPT will get ‘a lot better... fast’""",Tao_Dragon,False,0.96,79,https://www.independent.co.uk/tech/chatgpt-openai-agi-ai-chat-b2252002.html,38,1673448924.0,
37,125a9ry,artificial,Open-AI,comments,2023-03-29 02:19:43,"Elon Musk, Y Bengio, Andrew Yang etc called for a temporary pause on training systems exceeding GPT-4",duyt1001,False,0.57,3,https://www.reddit.com/r/artificial/comments/125a9ry/elon_musk_y_bengio_andrew_yang_etc_called_for_a/,28,1680056383.0,"Citing risks to society and humanity, a lot of people signed an open letter to call for a pause on training > GPT-4

[https://futureoflife.org/open-letter/pause-giant-ai-experiments/](https://futureoflife.org/open-letter/pause-giant-ai-experiments/)"
38,11b0i1j,artificial,Open-AI,comments,2023-02-24 20:00:25,That's getting interesting - LLaMA,Linkology,False,0.94,199,https://i.redd.it/riesfstch8ka1.jpg,32,1677268825.0,
