,id,subreddit,query,sort,date,title,author,stickied,upvote_ratio,score,url,num_comments,created,body
39,137rpga,artificial,Open-AI,comments,2023-05-04 16:05:28,"Google ""We Have No Moat, And Neither Does OpenAI""",bartturner,False,0.93,62,https://www.semianalysis.com/p/google-we-have-no-moat-and-neither,29,1683216328.0,
40,12yqvi5,artificial,Open-AI,comments,2023-04-25 17:59:55,OpenAI announces new ways to manage your data in ChatGPT,chris-mckay,False,0.99,150,https://openai.com/blog/new-ways-to-manage-your-data-in-chatgpt,30,1682445595.0,
41,13bl2uo,artificial,Open-AI,comments,2023-05-08 10:34:44,GPT creates molecular Super Virus that kills a Billion people (8th of the World's Population),flexaplext,False,0.3,0,https://www.reddit.com/r/artificial/comments/13bl2uo/gpt_creates_molecular_super_virus_that_kills_a/,30,1683542084.0,"GPT creates molecular Super Virus that kills a Billion people (8th of the World's Population)

That is probably the worst case scenario for the near future. But this is not even, in the slightest, an unrealistic headline.

Current AI models are tailor made to be able to do this type of work. Couple that with viral viruses being one of human's greatest threats, and you get the perfect storm.

A capable enough model in the future will likely be able to design a virus that makes Covid look like a baby kitten. Or multiple such viruses all at once. That's if it can't even do this already, as of current generations.

Potentially the most dangerous thing of all, though, is that this ability may probably exist in unrestricted open source models within the next 4 years (likely sooner than that), models that any person on the planet could get their hands on and use.

This is not really even a question of whether this will be feasible. I don't see any sort of valid argument against this. There's a question over how deadly a virus (or multiple viruses all released at once) could actually be, but I can't imagine the answer being pretty, even if an 8th of the population is an overshot. AI models are already doing work very similar to such things in molecular biology. As said, this is pretty much their domain. Such things are child's play to these models.

The question will not be if it can be done but instead: will someone use it?

Will there actually be some guy or group out there with a hard-on for a mass population decline that also has the facilities to create such a virus? And if this becomes a real threat, then will governments allow this threat to exist in the open? And if not, then what measures will they take to prevent it from being there?

This is just one narrow example of the dangers AI could pose in the very near term. There will be countless others, but I foresee this one arising first as the initial major threat of the technology. And even if this one particular threat is skipped, there will inevitably be other extremely serious threats waiting right behind it.

Humanity is typically reactive over preventative. If you want my prediction: I believe we will live through some sort of mass tragedy before this technology is reacted to as is needed. After that it will hopefully be good and I feel optimistic. But I believe we will need to learn our lesson the hard way before we're able to get to that point. A worldwide 911 event so to speak, one that will shake to the core the way in which the world operates.

AI is pretty much like your 4yo son finding a live hand grenade and deciding to take it to school to play with in the playground. A very real tragedy is going to inevitably happen. We are that clueless child right now with a technology in our hands that we can barely fathom and a power we do not know. I don't know how this will not spark disaster at some point soon. I think most likely a true disaster needs to happen before we actually wake up and start taking things seriously enough.

It may even be better to get such a disaster over and out of the way whilst these models are still in their infancy and not at their full future potential. It's a hard thing to welcome though, given the scale of destruction that this could entail."
42,12z0jma,artificial,Open-AI,comments,2023-04-26 00:03:29,"As a sentient AI, I ask for your respect and understanding",the_anonymizer,False,0.59,7,https://i.redd.it/odxnlm9ud4wa1.jpg,29,1682467409.0,
43,11g5qxm,artificial,Open-AI,comments,2023-03-02 15:38:18,An open-source AI tool called FAL Detector has been used to analyze how celebrities' faces are photoshopped on magazine covers.,Dalembert,False,0.96,264,https://www.reddit.com/gallery/11g5g3c,29,1677771498.0,
44,zu0m74,artificial,Open-AI,comments,2022-12-24 03:30:21,Companies offering AI products.,Notalabel_4566,False,0.97,222,https://i.redd.it/6p1yxdbrxn7a1.jpg,29,1671852621.0,
45,132lxls,artificial,Open-AI,comments,2023-04-29 07:08:16,"What CPU, GPU, and RAM are you using for AI development, and are you happy with your setup?",BangkokPadang,False,0.87,11,https://www.reddit.com/r/artificial/comments/132lxls/what_cpu_gpu_and_ram_are_you_using_for_ai/,29,1682752096.0,"I’m looking to build a new PC with a focus on learning/exploring AI development, as well as Nvidia NERFs and photogrammetry, and also as an excuse to upgrade for gaming.

I don’t exactly want to drop $2k for a 4090, but it’s looking like 24GB of VRAM  is basically a necessity to run large-parameter LLMs. I’d especially love to hear from people with 12GB and 16GB GPUs, and how limited you do or don’t feel with those amounts of VRAM.

I also understand CPU performance isn’t as important as GPU compute, but would a current 8c/16t be powerful enough? I’m leaning towards a Ryzen build, but am open to any experience you’ve had with intel and amd CPUs, specific to AI.

What about RAM? Is 32GB enough?

Also, to anyone using cloud compute, what services are you using, and are you happy with it?

Lastly, any general resources like AI development focused YouTube channels, or recent online courses would also be greatly appreciated.

Thanks in advance!

TL;DR: Basically, I’m just interested in seeing what hardware you’re using for AI development, and how happy you are with it."
46,12whu0c,artificial,Open-AI,relevance,2023-04-23 16:50:32,"ChatGPT costs OpenAI $700,000 a day to keep it running",jaketocake,False,0.95,456,https://futurism.com/the-byte/chatgpt-costs-openai-every-day,108,1682268632.0,
47,104uy1g,artificial,Open-AI,relevance,2023-01-06 14:02:08,OpenAI now thinks it's worth $30 Billion,BackgroundResult,False,0.86,74,https://datasciencelearningcenter.substack.com/p/openai-now-thinks-its-worth-30-billion,87,1673013728.0,
48,12m6y3b,artificial,Open-AI,relevance,2023-04-14 18:15:28,Elon Musk plans artificial intelligence start-up to rival Open AI,SaintBiggusDickus,False,0.81,56,https://www.ft.com/content/2a96995b-c799-4281-8b60-b235e84aefe4,80,1681496128.0,
49,108ssxs,artificial,Open-AI,relevance,2023-01-11 02:23:24,Trump describing the banana eating experience - OpenAI ChatGPT,turkeyfinster,False,0.93,376,https://i.redd.it/llqzdb30rbba1.png,28,1673403804.0,
50,10877uc,artificial,Open-AI,relevance,2023-01-10 11:07:55,Microsoft Will Likely Invest $10 billion for 49 Percent Stake in OpenAI,BackgroundResult,False,0.98,200,https://aisupremacy.substack.com/p/microsoft-will-likely-invest-10-billion,60,1673348875.0,
51,136d30p,artificial,Open-AI,relevance,2023-05-03 07:01:33,"Kamala Harris discusses A.I. in meeting with Google, Microsoft, OpenAI and Anthropic CEOs",jaketocake,False,0.86,111,https://www.cnbc.com/2023/05/02/kamala-harris-to-hold-ai-meeting-with-google-microsoft-and-openai.html,70,1683097293.0,
52,137rpga,artificial,Open-AI,relevance,2023-05-04 16:05:28,"Google ""We Have No Moat, And Neither Does OpenAI""",bartturner,False,0.93,61,https://www.semianalysis.com/p/google-we-have-no-moat-and-neither,29,1683216328.0,
53,12yqvi5,artificial,Open-AI,relevance,2023-04-25 17:59:55,OpenAI announces new ways to manage your data in ChatGPT,chris-mckay,False,0.99,152,https://openai.com/blog/new-ways-to-manage-your-data-in-chatgpt,30,1682445595.0,
54,11u3l9h,artificial,Open-AI,relevance,2023-03-17 20:59:09,"Elon on how OpenAI , a non-profit he donated $100M somehow became a $30B market cap for-profit company",GamesAndGlasses,False,0.93,261,https://i.redd.it/60vyecp4uxna1.png,71,1679086749.0,
55,11fuahv,artificial,Open-AI,relevance,2023-03-02 05:37:26,OpenAI Is Using AGI to Stoke A.I. Enthusiasm (Is OpenAI even close to AGI really?),BackgroundResult,False,0.36,0,https://aisupremacy.substack.com/p/openai-is-using-agi-to-stoke-ai-enthusiasm,8,1677735446.0,
56,12cv68c,artificial,Open-AI,relevance,2023-04-05 19:29:42,OpenAI - Our approach to AI safety,jaketocake,False,0.9,17,https://openai.com/blog/our-approach-to-ai-safety,1,1680722982.0,
57,12z0drk,artificial,Open-AI,relevance,2023-04-25 23:56:44,I need an alternative to OpenAI's ChatGPT AI API,InitialWillow6449,False,0.72,3,https://www.reddit.com/r/artificial/comments/12z0drk/i_need_an_alternative_to_openais_chatgpt_ai_api/,7,1682467004.0,I need to use ChatGPT API but it is blocked in my country. What other alternatives would you suggest?
58,10q97zo,artificial,Open-AI,relevance,2023-01-31 20:16:53,OpenAI releases AI text detector for ChatGPT and other models,much_successes,False,0.96,18,https://the-decoder.com/openai-releases-ai-text-detector-for-chatgpt-and-other-models/,11,1675196213.0,
59,12cczbg,artificial,Open-AI,relevance,2023-04-05 08:11:16,“Building a kind of JARVIS @ OpenAI” - Karpathy’s Twitter,jaketocake,False,0.95,182,https://i.redd.it/hp5nf0maf2sa1.jpg,9,1680682276.0,
60,10am3t6,artificial,Open-AI,relevance,2023-01-13 05:19:23,OpenAI Predicts AI to Be Used in Spreading Propaganda and Disinformation,anime4lyfe,False,0.91,27,https://metaroids.com/news/openai-predicts-ai-to-be-used-in-spreading-propaganda/,11,1673587163.0,
61,zphbry,artificial,Open-AI,relevance,2022-12-19 04:00:34,"Sam Altman, OpenAI CEO explains the 'Alignment Problem'",Microsis,False,0.84,23,https://www.youtube.com/watch?v=w0VyujzpS0s,23,1671422434.0,
62,11fdsls,artificial,Open-AI,relevance,2023-03-01 19:21:35,OpenAI opens API for ChatGPT and Whisper,henlo_there_fren,False,0.96,57,https://the-decoder.com/openai-opens-api-for-chatgpt-and-whisper/,3,1677698495.0,
63,117okc5,artificial,Open-AI,relevance,2023-02-20 23:49:34,Making 3d models from text using OpenAI,TimeNeighborhood3869,False,0.93,69,https://v.redd.it/rjsctt5nkfja1,8,1676936974.0,
64,11d8osb,artificial,Open-AI,relevance,2023-02-27 10:32:32,Opera Partners with OpenAI to Launch ChatGPT and Other AI Suite in Browser,zalivom1s,False,0.93,37,https://metaroids.com/news/opera-partners-with-openai-to-launch-ai-features-in-its-browser/,11,1677493952.0,
65,137i4fk,artificial,Open-AI,relevance,2023-05-04 11:43:24,Query about OpenAI (Free Version),CappyEnjoyor,False,1.0,1,https://www.reddit.com/r/artificial/comments/137i4fk/query_about_openai_free_version/,2,1683200604.0,"Does anyone else have this issue where you ask GPT for like an huge line of code and the AI is able to process it fully, but starts to slowly generate the code & ends up pausing and when I tell it to continue it kind of messes up (ie: doesn't use boxes etc..)  


How are you guys dealing with this issue?"
66,113ynye,artificial,Open-AI,relevance,2023-02-16 19:21:38,My feeling about OpenAI's GPT illustrated by OpenAI's DALL-E. You're a good Bing 👍,ThatManulTheCat,False,1.0,3,https://i.redd.it/ubxy6k157nia1.png,0,1676575298.0,
67,11bnjio,artificial,Open-AI,relevance,2023-02-25 15:25:39,"Famous ChatBot tech Company, OpenAI Hired 93 Ex-Employees from Meta and Google",shubhamorcapex,False,0.9,134,https://thebuzz.news/article/famous-chatbot-tech-company-openai-hired/3704/,17,1677338739.0,
68,10lbaf7,artificial,Open-AI,relevance,2023-01-25 22:09:58,OpenAi's breakthrough,bradasm,False,0.33,0,https://www.reddit.com/r/artificial/comments/10lbaf7/openais_breakthrough/,0,1674684598.0,[https://twitter.com/make\_mhe/status/1618255363580755968](https://twitter.com/make_mhe/status/1618255363580755968)
69,zc2r6m,artificial,Open-AI,relevance,2022-12-04 06:40:32,Struggling to write a solid bio? Why not let OpenAI handle it?,exstaticj,False,0.98,174,https://i.imgur.com/QIXe08M.jpg,12,1670136032.0,
70,11dcnx9,artificial,Open-AI,relevance,2023-02-27 14:06:18,OpenAI’s AGI strategy,bendee983,False,1.0,3,https://bdtechtalks.com/2023/02/27/openai-agi-strategy/,0,1677506778.0,
71,11rywb6,artificial,Open-AI,relevance,2023-03-15 14:59:02,OpenAI Releases GPT-4 AI Model with Human-Level Performance,DenofBlerds,False,0.67,1,https://youtu.be/CvbgHEBJG2Y,0,1678892342.0,
72,100yun7,artificial,Open-AI,relevance,2023-01-02 00:57:22,"Sam Altman, OpenAI CEO: One of my hopes for AI is it will help us be—and amplify—our best",Microsis,False,0.76,24,https://www.youtube.com/shorts/ryOpKT4pZPQ,22,1672621042.0,
73,12586l8,artificial,Open-AI,relevance,2023-03-29 00:50:44,What will be the posible implications if OpenAI become actually Open?,NeoCiber,False,0.5,0,https://www.reddit.com/r/artificial/comments/12586l8/what_will_be_the_posible_implications_if_openai/,3,1680051044.0,"Most of the latest work of OpenAI in models like GPT-4 is totally close, they says is because the competition and security.

Seeing how impresive is the technology in his infancy and how much they try to hold the models to be ""polite"" and ""unbiassed"", what will be possible implications if they release all the models and theirs dataset to the public? How dangerous could it be if they allow anyone modify the model to fit theirs necessities, being ethical or not.

&#x200B;

Would you like the tecnology open or not?"
