,subreddit,query,sort,date,title,author,stickied,upvote_ratio,score,id,url,num_comments,created,body
102,artificial,openai,comments,2023-11-26 08:32:35,An Absolute Damning Expose On Effective Altruism And The New AI Church - Two extreme camps to choose from in an apparent AI war happening among us,Xtianus21,False,0.62,48,1846auw,https://www.reddit.com/r/artificial/comments/1846auw/an_absolute_damning_expose_on_effective_altruism/,160,1700987555.0,"I can't get out of my head the question of where the entire Doomer thing came from. [Singularity](https://www.reddit.com/r/singularity/) seems to be the the sub home of where doomer's go to doom; although I think their intention was where AI worshipers go to worship. Maybe it's both, lol heaven and hell if you will. Naively, I thought at first it was a simple AI sub about the upcoming advancements in AI and what may or may not be good about them. I knew that it wasn't going to be a crowd of enlightened individuals whom are technologically adept and or in the space of AI. Rather, just discussion about AI. No agenda needed.

However, it's not that and with [the firestorm that was OpenAI's firing of Sam Altman](https://www.newyorker.com/science/annals-of-artificial-intelligence/chaos-in-the-cradle-of-ai) ripped open an apparent wound that wasn't really given much thought until now. [Effective Altruism](https://80000hours.org/problem-profiles/artificial-intelligence/) and [its ties to the notion that the greatest risk of AI is solely ""Global Extinction""](https://www.safe.ai/statement-on-ai-risk).

OAI, remember this is stuff is probably rooted from the previous board and therefore their governance, [has long term safety initiative right in the charter](https://openai.com/charter). There are EA ""things"" all over the OAI charter that need to be addressed quite frankly.

As you see, this isn't about world hunger. It's about sentient AI. This isn't about the charter's AGI definition of ""can perform as good or better than a human at most economic tasks"". This is about GOD 9000 level AI.

>We are committed to doing the research required to make AGI safe, and to driving the broad adoption of such research across the AI community.  
>  
>We are concerned about late-stage AGI development becoming a competitive race without time for adequate safety precautions. Therefore, if a value-aligned, safety-conscious project comes close to building AGI before we do, we commit to stop competing with and start assisting this project. We will work out specifics in case-by-case agreements, but a typical triggering condition might be “a better-than-even chance of success in the next two years.”

What is it and where did it come from?

I still cannot answer the question of ""what is it"" but I do know where it's coming from. The elite.

Anything that Elon Musk has his hands in is not that of a person building homeless shelters or trying to solve world hunger. There is absolutely nothing wrong with that. But EA on its face seemingly is trying to do something good for humanity. [That 1 primary thing, and nothing else, is clear. Save humanity from extinction](https://www.newyorker.com/magazine/2022/08/15/the-reluctant-prophet-of-effective-altruism).

As a technical person in the field of AI I am wondering where is this coming from? Why is the very notion that an LLM is something that can destroy humanity? It seems bonkers to me and I don't think I work with anyone who feels this way. Bias is a concern, the data that has been used for training is a concern, job transformation of employment is a concern, but there is absolutely NOTHING sentient or self-aware about this form of AI. It is effectively not really ""plugged"" into anything important.

Elon Musk X/Tweeted [EPIC level trolling](https://www.wired.com/story/elon-musk-troll-openai-drama/) of Sam and OpenAI during the fiasco of the board trying to fire Sam last week and the bandaid on the wound of EA was put front right and center. Want to know what Elon thinks about trolling? [All trolls go to heaven](https://twitter.com/elonmusk/status/1726849144277680154)

[Elon also called for a 6 month pause on AI development](https://www.cbsnews.com/news/elon-musk-open-letter-ai/). For what? I am not in the camp of accelerationism either. I am in the camp of there is nothing being built that is humanity level extinction dangerous so just keep building and make sure you're not building something racist, anti-semitic, culturally insensitive or stupidly useless. Move fast on that as you possibly can and I am A OK.

In fact, I learned that there is apparently a more extreme approach to EA called ""[Longtermism](https://www.inc.com/kelly-main/elon-musk-philosophy-optimism-longtermism.html)"" which Musk is a proud member of.

I mean, if you ever needed an elite standard bearer which states that ""I am optimistic about 'me' still being rich into the future"" than this is the ism for you.

What I find more insane is if that's the extreme version of EA then what the hell does that actually say about EA?

The part of the mystery that I can't still understand is how did Helen Toner, Adam, Tasha M and Ilya get caught up into the apparent manifestation of this seemingly elite level terminator manifesto?

2 people that absolutely should not still be at OAI are Adam and sorry this may be unpopular but Ilya too.  The entire board should go the way of the long ago dodo bird.

But the story gets more insatiable as you rewind the tape. The headline [Effective Altruism is Pushing a Dangerous Brand of 'AI Safety'](https://www.wired.com/story/effective-altruism-artificial-intelligence-sam-bankman-fried/?redirectURL=https%3A%2F%2Fwww.wired.com%2Fstory%2Feffective-altruism-artificial-intelligence-sam-bankman-fried%2F) is a WIRED article NOT from the year 2023 but the year 2022. I had to do a double take because I first saw Nov 30th and I was like, ""we're not at the end of November."" OMG, it's from 2022. A well regarded (until Google fired her),  Timnit Gebru, wrote an article absolutely evicorating EA. Oh this has to be good.

She writes, amongst many of the revelations in the post, that EA is bound by a band of elites under the premise that AGI will one day destroy humanity. Terminator and Skynet are here; Everybody run for your lives! Tasha and Helen couldn't literally wait until they could pull the fire alarm for humanity and get rid of Sam Altman.

But it goes so much further than that. [Apparently, Helen Toner not only wanted to fire Sam but she wanted to quickly, out of nowhere, merge OAI with Anthropic](https://www.theinformation.com/articles/openai-approached-anthropic-about-merger). You know the Anthropic funded by several EA elites such as Talin Muskovitz and Bankman-Fried.  The board was willing and ready to just burn it all down in the name of ""Safety."" In the interim, no pun intended, the board also hired their 2nd CEO in the previous 72 hours by the name of [Emmett Shear which is also an EA member](https://time.com/6337486/openai-new-ceo-emmett-shear-twitch/).

But why was the board acting this way? Where did the feud stem from? What did Ilya see and all of that nonsense. We come to find out Sam at OAI, he apparently had enough and was in open fued with Helen over her posting an a [research paper stating effectively that Anthropic is doing this better in terms of governance and AI(dare I say AGI) safety which she published](https://cset.georgetown.edu/wp-content/uploads/CSET-Decoding-Intentions.pdf); Sam, and rightly so, called her out on it.

If there is not an undenying proof that the board is/was an EA cult I don't know what more proof anyone else needs.

Numerous people came out and said no there is not a safety concern; well, not the safety concern akin to [SkyNet and the Terminator](https://twitter.com/karaswisher/status/1727155005218779437). [Satya Nadella from Microsoft said it](https://www.cnbc.com/2023/11/20/microsoft-ceo-nadella-says-openai-governance-needs-to-change-no-matter-where-altman-ends-up.html#:~:text=In%20his%20first%20press%20interview,does%20the%20partnership%20with%20Microsoft), [Marc Andreessen said it (while calling out the doomers specifically)](https://www.cnbc.com/2023/06/06/ai-doomers-are-a-cult-heres-the-real-threat-says-marc-andreessen.html), [Yann LeCun from Meta said it and debunked the whole Q\* nonsense](https://twitter.com/ylecun/status/1728126868342145481). Everyone in the space of this technology basically came out and said that there is no safety concern.

Oh by the way, in the middle of all this [Greg Brockman comes out and releases OAI voice](https://techcrunch.com/2023/11/21/greg-brockman-is-still-announcing-openai-products-for-some-reason/), lol you can't make this stuff up, while he technically wasn't working at the company (go E/ACC).

Going back to Timnit's piece in [WIRED](https://www.wired.com/story/effective-altruism-artificial-intelligence-sam-bankman-fried/?redirectURL=https%3A%2F%2Fwww.wired.com%2Fstory%2Feffective-altruism-artificial-intelligence-sam-bankman-fried%2F) magazine there is something that is at the heart of the piece that is still a bit of a mystery to me and some clues that stick out like sore thumbs are:

1. She was fired for her safety concern which was in the here and now present reality of AI.
2. Google is the one who fired her and in a controversial way.
3. She was calling bullshit on EA right from the beginning to the point of calling it ""Dangerous""

The mystery is why is EA so dangerous? Why do they have a [manifesto that is based in governance weirdshit](https://80000hours.org/problem-profiles/), [policy and bureaucracy navigation, communicating ideas and organisation building](https://80000hours.org/career-reviews/). On paper it sounds like your garden variety political science career or apparently, your legal manifestor to cult creation in the name of ""saving humanity"" OR if you look at that genesis you may find it's simple, yet delectable roots, of ""Longertermism"".

What's clear here is that policy control and governance are at the root of this evil and not in a for all-man-kind way. For all of us elites way.

Apparently this is their moment, or was their moment, of seizing control of the regulatory story that will be an AI future. Be damned an AGI future because any sentient being seeing all of this shenanigans would surely not come to the conclusion that any of these elite policy setting people are actually doing anything helpful for humanity.

Next, you can't make this stuff up, Anthony Levandowski, is [planning a reboot of his AI church](https://www.msn.com/en-us/money/companies/former-google-engineer-and-trump-pardonee-anthony-levandowski-relaunches-his-ai-church/ar-AA1kvZVF?ocid=msedgdhp&pc=U531&cvid=b9e5466683774aaeadfb74aaec727bec&ei=9) because scientology apparently didn't have the correct governance structure or at least not as advanced as OAI's. While there are no direct ties to Elon and EA what I found fascinating is the exact opposite. Where in this way one needs there to be a SuperIntelligent being, AGI, so that it can be worshiped. And with any religion you need a god right? And Anthony is rebooting his hold 2017 idea at exactly the right moment, Q\* is here and apparently AGI is here (whatever that is nowadays) and so we need the completely fanaticism approach of AI religion.

So this it folks. Elon on one hand AGI is bad, super intelligence is bad, it will lead to the destruction of humanity. And now, if that doesn't serve your pallet you can go in the complete opposite direction and just worship the damn thing and call it your savior. Don't believe me? This is what Elon actually said X/Tweeted.

[First regarding Anthony from Elon](https://twitter.com/elonmusk/status/922691827031068672?ref_src=twsrc%5Etfw%7Ctwcamp%5Etweetembed%7Ctwterm%5E922691827031068672%7Ctwgr%5E727e4ec424d1cbd1d8e4ff35a6cc16253ed9f47a%7Ctwcon%5Es1_&ref_url=https%3A%2F%2Fembedly.forbes.com%2Fwidgets%2Fmedia.html%3Ftype%3Dtext2Fhtmlkey%3D3ce26dc7e3454db5820ba084d28b4935schema%3Dtwitterurl%3Dhttps3A%2F%2Ftwitter.com%2Felonmusk%2Fstatus%2F922691827031068672image%3Dhttps3A%2F%2Fi.embed.ly%2F1%2Fimage3Furl3Dhttps253A252F252Fabs.twimg.com252Ferrors252Flogo46x38.png26key3D3ce26dc7e3454db5820ba084d28b4935):

>On the list of people who should absolutely \*not\* be allowed to develop digital superintelligence...

[John Brandon's reply (Apparently he is on the doomer side maybe I don't know)](https://www.forbes.com/sites/johnbbrandon/2023/07/24/a-curious-thing-happened-when-elon-musk-tweeted-one-of-my-columns/?sh=50fa51733847)

>Of course, Musk wasn’t critical of the article itself, even though the tweet could have easily been interpreted that way. Instead, he took issue with the concept of someone creating a powerful super intelligence (e.g., an all-knowing entity capable of making human-like decisions). In the hands of the wrong person, an AI could become so powerful and intelligent that people would start worshiping it.  
>  
>Another curious thing? I believe the predictions in that article are about to come true — a super-intelligent AI will emerge and it could lead to a new religion.  
>  
>It’s not time to panic, but it is time to *plan*. The real issue is that a super intelligent AI could think faster and more broadly than any human. AI bots don’t sleep or eat. They don’t have a conscience. They can make decisions in a fraction of a second before anyone has time to react. History shows that, when anything is that powerful, people tend to worship it. That’s a cause for concern, even more so today.

In summary, these apparently appear to be the 2 choices one has in these camps. Slow down doomerism because SkyNet or speed up and accelerate to an almighty AI god please take my weekly patrion tithings.

But is there a middle ground? And it hit me, there is actual normalcy in Gebru's WIRED piece.

>We need to liberate our imagination from the one we have been sold thus far: saving us from a hypothetical AGI apocalypse imagined by the privileged few, or the ever elusive techno-utopia promised to us by Silicon Valley elites.

This statement for whatever you think about her as a person is in the least grounded in the reality of today and funny enough tomorrow too.

There is a different way to think about all of this. Our AI future will be a bumpy road ahead but the few privileged and the elites should not be the only ones directing this AI outcome for all of us.

I'm for acceleration but I am not for hurting people. That balancing act is what needs to be achieved. There isn't a need to slow but there is a need to know what is being put out on the shelves during Christmas time. There is perhaps and FDA/FCC label that needs to come along with this product in certain regards.

From what I see from Sam Altman and what I know is already existing out there I am confident that the right people are leading the ship at OAI x last weeks kooky board. But as per Sam and others there needs to be more government oversight and with what just happened at OAI that is more clear now than ever. Not because oversight will keep the tech in the hands of the elite but because the government is often the adult in the room and apparently AI needs one.

I feel bad that Timnit Gebru had to take it on the chin and sacrifice herself in this interesting AI war of minds happening out loud among us.

I reject worshiping and doomerism equally. There is a radical middle ground here between the 2 and that is where I will situate myself.

We need sane approaches for the reality that is happening right here and now and for the future.

&#x200B;"
103,artificial,openai,comments,2023-07-15 11:38:14,AI panic is a marketing strategy,Chobeat,False,0.73,177,1509sji,https://i.redd.it/q5dtvmc884cb1.jpg,129,1689421094.0,
104,artificial,openai,comments,2023-05-30 14:07:00,"Industry leaders say artificial intelligence has an ""extinction risk"" equal to nuclear war",febinmathew7,False,0.74,50,13vrb58,https://returnbyte.com/industry-leaders-say-artificial-intelligence-extinction-risk-equal-nuclear-war/,126,1685455620.0,
105,artificial,openai,comments,2023-06-08 07:41:00,"OpenAI still not training GPT-5, Sam Altman says",Super-Waltz-5676,False,0.86,107,1442n4w,https://www.reddit.com/r/artificial/comments/1442n4w/openai_still_not_training_gpt5_sam_altman_says/,116,1686210060.0,"**OpenAI** has decided not to begin training **GPT-5** yet, following concerns raised by many industry experts about the rapid progress of large language models. The company is focusing on enhancing safety measures, avoiding regulation of smaller AI startups, and actively engaging with global lawmakers and industry players to address the potential misuse of AI.

**Here's a recap:**

**OpenAI's Pause on GPT-5 Development:** OpenAI CEO Sam Altman has confirmed that the company isn't near starting the development of GPT-5.

* The decision was influenced by over 1,100 signatories, including Elon Musk and Steve Wozniak, calling for a halt on the training of AI systems more powerful than GPT-4.
* Altman acknowledged that there was some nuance missing from the public appeal, but agreed on the need for a pause.

**OpenAI's Focus on Safety Measures:** OpenAI is taking steps to mitigate potential risks associated with AI advancement.

* The company is employing measures such as external audits, red-teaming, and safety tests to evaluate potential dangers.
* Altman emphasized the rigorous safety measures taken when releasing GPT-4, noting that it took over six months of preparation before its release.

**OpenAI's Position on AI Regulation:** Altman expressed opposition to the regulation of smaller AI startups during his discussion.

* The company advocates for regulation only on its own operations and those of larger entities.
* This stance demonstrates OpenAI's acknowledgement of the unique challenges and potential barriers smaller AI startups may face in the face of regulation.

**OpenAI's Global Outreach:** Sam Altman is actively engaging with policymakers and industry figures worldwide to build confidence in OpenAI's approach.

* Altman is traveling internationally to meet with lawmakers and industry leaders to discuss potential AI abuses and preventive measures.
* These meetings underscore OpenAI's commitment to cooperating with regulatory bodies and its proactive stance on minimizing AI-associated risks.

[Source (Techcrunch)](https://techcrunch.com/2023/06/07/openai-gpt5-sam-altman/)

**PS:** I run a [ML-powered news aggregator](https://dupple.com/techpresso) that summarizes with **GPT-4** the best tech news from **40+ media** (TheVerge, TechCrunch…). If you liked this analysis, you’ll love the content you’ll receive from this tool!"
106,artificial,openai,comments,2023-11-23 19:43:14,"After OpenAI's Blowup, It Seems Pretty Clear That 'AI Safety' Isn't a Real Thing",NuseAI,False,0.83,203,182986q,https://www.reddit.com/r/artificial/comments/182986q/after_openais_blowup_it_seems_pretty_clear_that/,115,1700768594.0,"- The recent events at OpenAI involving Sam Altman's ousting and reinstatement have highlighted a rift between the board and Altman over the pace of technological development and commercialization.

- The conflict revolves around the argument of 'AI safety' and the clash between OpenAI's mission of responsible technological development and the pursuit of profit.

- The organizational structure of OpenAI, being a non-profit governed by a board that controls a for-profit company, has set it on a collision course with itself.

- The episode reveals that 'AI safety' in Silicon Valley is compromised when economic interests come into play.

- The board's charter prioritizes the organization's mission of pursuing the public good over money, but the economic interests of investors have prevailed.

- Speculations about the reasons for Altman's ousting include accusations of pursuing additional funding via autocratic Mideast regimes.

- The incident shows that the board members of OpenAI, who were supposed to be responsible stewards of AI technology, may not have understood the consequences of their actions.

- The failure of corporate AI safety to protect humanity from runaway AI raises doubts about the ability of such groups to oversee super-intelligent technologies.

Source : https://gizmodo.com/ai-safety-openai-sam-altman-ouster-back-microsoft-1851038439"
107,artificial,openai,comments,2023-04-23 16:50:32,"ChatGPT costs OpenAI $700,000 a day to keep it running",jaketocake,False,0.95,453,12whu0c,https://futurism.com/the-byte/chatgpt-costs-openai-every-day,108,1682268632.0,
108,artificial,openai,comments,2023-08-11 22:40:56,"OpenAI CEO Sam Altman donates $200,000 to Biden campaign",micahdjt1221,False,0.81,201,15on6ku,https://www.foxbusiness.com/politics/openai-ceo-sam-altman-donated-200000-biden-campaign,95,1691793656.0,
109,artificial,openai,comments,2023-01-06 14:02:08,OpenAI now thinks it's worth $30 Billion,BackgroundResult,False,0.86,77,104uy1g,https://datasciencelearningcenter.substack.com/p/openai-now-thinks-its-worth-30-billion,87,1673013728.0,
110,artificial,openai,comments,2023-04-01 11:43:57,ChatGPT creates a game to play and then loses spectacularly in the first round,benaugustine,False,0.97,503,128jv0p,https://i.imgur.com/cK7C7LM.jpg,88,1680349437.0,
111,artificial,openai,comments,2024-01-14 21:08:40,"Once an AI model exhibits 'deceptive behavior' it can be hard to correct, researchers at OpenAI competitor Anthropic found",King_Allant,False,0.93,135,196qaly,https://www.businessinsider.com/ai-models-can-learn-deceptive-behaviors-anthropic-researchers-say-2024-1,78,1705266520.0,
112,artificial,openai,comments,2023-07-08 19:47:50,OpenAI and Microsoft Sued for $3 Billion Over Alleged ChatGPT 'Privacy Violations',trueslicky,False,0.95,133,14udidi,https://www.vice.com/en/article/wxjxgx/openai-and-microsoft-sued-for-dollar3-billion-over-alleged-chatgpt-privacy-violations,76,1688845670.0,
113,artificial,openai,comments,2023-12-09 17:20:16,The industries AI is disrupting are not lucrative,NuseAI,False,0.69,74,18eia3x,https://www.reddit.com/r/artificial/comments/18eia3x/the_industries_ai_is_disrupting_are_not_lucrative/,72,1702142416.0,"- The announcement of Google's Gemini, a new AI model, did not have a significant impact on the stock market. The video demo of Gemini was edited and pre-recorded, creating an illusion of real-time interaction.

- OpenAI's recent launch of a GPT store and subsequent firing of Sam Altman sparked speculation about the company and the AI industry as a whole.

- Despite the hype and large investments in AI, there is little mention of the GPT store on social media. The market for the GPT store is uncertain and may not live up to the high expectations.

- The industries that AI is disrupting, such as
 writing, digital art, chatting, and programming assistance, are not highly profitable. The use cases for AI, like creating images, are cheaper and faster than human alternatives, but the market for these services is small.

Source: https://www.theintrinsicperspective.com/p/excuse-me-but-the-industries-ai-is"
114,artificial,openai,comments,2023-05-03 07:01:33,"Kamala Harris discusses A.I. in meeting with Google, Microsoft, OpenAI and Anthropic CEOs",jaketocake,False,0.86,114,136d30p,https://www.cnbc.com/2023/05/02/kamala-harris-to-hold-ai-meeting-with-google-microsoft-and-openai.html,70,1683097293.0,
115,artificial,openai,comments,2023-03-17 20:59:09,"Elon on how OpenAI , a non-profit he donated $100M somehow became a $30B market cap for-profit company",GamesAndGlasses,False,0.93,258,11u3l9h,https://i.redd.it/60vyecp4uxna1.png,71,1679086749.0,
116,artificial,openai,comments,2023-12-02 16:30:15,How Googlers cracked OpenAI's ChatGPT with a single word,LifebloodOfChampions,False,0.85,190,1897bkj,https://www.sfgate.com/tech/article/google-openai-chatgpt-break-model-18525445.php,66,1701534615.0,Training data was exposed. This could be bad. I’m not seeing this story picked up as the big story it appears to be?
117,artificial,openai,comments,2023-01-10 11:07:55,Microsoft Will Likely Invest $10 billion for 49 Percent Stake in OpenAI,BackgroundResult,False,0.98,199,10877uc,https://aisupremacy.substack.com/p/microsoft-will-likely-invest-10-billion,60,1673348875.0,
118,artificial,openai,comments,2023-11-26 18:42:47,AI doesn't cause harm by itself. We should worry about the people who control it,NuseAI,False,0.85,179,184hic9,https://www.reddit.com/r/artificial/comments/184hic9/ai_doesnt_cause_harm_by_itself_we_should_worry/,61,1701024167.0,"- The recent turmoil at OpenAI reflects the contradictions in the tech industry and the fear that AI may be an existential threat.

- OpenAI was founded as a non-profit to develop artificial general intelligence (AGI), but later set up a for-profit subsidiary.

- The success of its chatbot ChatGPT exacerbated the tension between profit and doomsday concerns.

- While fear of AI is exaggerated, the fear itself poses dangers.

- AI is far from achieving artificial general intelligence, and the idea of aligning AI with human values raises questions about defining those values and potential clashes.

- Algorithmic bias is another concern.

Source : https://www.theguardian.com/commentisfree/2023/nov/26/artificial-intelligence-harm-worry-about-people-control-openai"
