,subreddit,query,sort,date,title,author,stickied,upvote_ratio,score,id,url,num_comments,created,body
0,artificial,openai,top,2023-11-17 20:58:36,Sam Altman fired as CEO of OpenAI,Remarkable_Ad9528,False,0.97,512,17xow5o,https://www.reddit.com/r/artificial/comments/17xow5o/sam_altman_fired_as_ceo_of_openai/,225,1700254716.0,"Sam Altman has been [fired as the CEO of OpenAI](https://www.gptroad.com/item?id=c9526da2-4b2a-48c8-a8cc-e37a79786a4b) following a board review that questioned his candor in communications, with Mira Murati stepping in as interim CEO."
1,artificial,openai,top,2023-04-01 11:43:57,ChatGPT creates a game to play and then loses spectacularly in the first round,benaugustine,False,0.97,503,128jv0p,https://i.imgur.com/cK7C7LM.jpg,88,1680349437.0,
2,artificial,openai,top,2023-04-23 16:50:32,"ChatGPT costs OpenAI $700,000 a day to keep it running",jaketocake,False,0.95,452,12whu0c,https://futurism.com/the-byte/chatgpt-costs-openai-every-day,108,1682268632.0,
3,artificial,openai,top,2023-01-11 02:23:24,Trump describing the banana eating experience - OpenAI ChatGPT,turkeyfinster,False,0.93,379,108ssxs,https://i.redd.it/llqzdb30rbba1.png,28,1673403804.0,
4,artificial,openai,top,2023-12-07 13:04:05,Let's take a pause,Asleep-Television-24,False,0.9,332,18cv5m0,https://i.redd.it/bz0ggverfv4c1.jpg,29,1701954245.0,
5,artificial,openai,top,2023-03-19 06:02:41,I got access to gpt-4 and I am using it for the betterment of *checks notes* society.,HolyOtherness,False,0.97,311,11vd31k,https://i.redd.it/7q56s81vgooa1.png,28,1679205761.0,
6,artificial,openai,top,2023-12-01 10:16:22,"One year later, ChatGPT is still alive and kicking. OpenAI's AI language model, ChatGPT, has over 100 million active users every week, making it the fastest-growing consumer product ever.",Upbeat-Interaction13,False,0.94,300,1888hu9,https://techcrunch.com/2023/11/30/one-year-later-chatgpt-is-still-alive-and-kicking/,57,1701425782.0,
7,artificial,openai,top,2023-03-17 20:59:09,"Elon on how OpenAI , a non-profit he donated $100M somehow became a $30B market cap for-profit company",GamesAndGlasses,False,0.93,265,11u3l9h,https://i.redd.it/60vyecp4uxna1.png,71,1679086749.0,
8,artificial,openai,top,2024-02-16 21:40:33,"Explaining OpenAI Sora's Technology, The Vital Next Step In Machines Simulating Our World",koconder,False,0.94,235,1askfyz,https://www.reddit.com/r/artificial/comments/1askfyz/explaining_openai_soras_technology_the_vital_next/,21,1708119633.0,"How can AI transform a static image into a dynamic, realistic video? OpenAI’s Sora introduces an answer through the innovative use of spacetime patches.

I did an explainer on Sora's underlying training process and patches [https://towardsdatascience.com/explaining-openai-soras-spacetime-patches-the-key-ingredient-e14e0703ec5b](https://towardsdatascience.com/explaining-openai-soras-spacetime-patches-the-key-ingredient-e14e0703ec5b)  


[Image Slicing Processes](https://i.redd.it/e5yccw3io0jc1.gif)

It's ability to understand and develop near perfect visual simulations including digital worlds like Minecraft will help it create training content for the AI's of tomorrow. For AI's  to navigate our world it needs data and systems to help it better comprehend.

We can now unlock new heights of virtual  reality (VR) as it changes the way we see digital environments, moving  the boundaries of VR to new heights. The ability to create near perfect  3D environments which we can now pair with spatial computing for worlds  on demand on Apple Vision Pro or Meta Quest."
9,artificial,openai,top,2022-12-24 03:30:21,Companies offering AI products.,Notalabel_4566,False,0.97,226,zu0m74,https://i.redd.it/6p1yxdbrxn7a1.jpg,29,1671852621.0,
10,artificial,openai,top,2023-11-23 11:55:25,"OpenAI Unleashes Free Voice Chat Feature to All Mobile Users, Offering Siri-like Experience",Upbeat-Interaction13,False,0.96,201,181zlsn,https://techcrunch.com/2023/11/22/forget-siri-turn-your-iphones-action-button-into-a-chatgpt-voice-assistant-instead/,48,1700740525.0,
11,artificial,openai,top,2023-11-23 19:43:14,"After OpenAI's Blowup, It Seems Pretty Clear That 'AI Safety' Isn't a Real Thing",NuseAI,False,0.83,202,182986q,https://www.reddit.com/r/artificial/comments/182986q/after_openais_blowup_it_seems_pretty_clear_that/,115,1700768594.0,"- The recent events at OpenAI involving Sam Altman's ousting and reinstatement have highlighted a rift between the board and Altman over the pace of technological development and commercialization.

- The conflict revolves around the argument of 'AI safety' and the clash between OpenAI's mission of responsible technological development and the pursuit of profit.

- The organizational structure of OpenAI, being a non-profit governed by a board that controls a for-profit company, has set it on a collision course with itself.

- The episode reveals that 'AI safety' in Silicon Valley is compromised when economic interests come into play.

- The board's charter prioritizes the organization's mission of pursuing the public good over money, but the economic interests of investors have prevailed.

- Speculations about the reasons for Altman's ousting include accusations of pursuing additional funding via autocratic Mideast regimes.

- The incident shows that the board members of OpenAI, who were supposed to be responsible stewards of AI technology, may not have understood the consequences of their actions.

- The failure of corporate AI safety to protect humanity from runaway AI raises doubts about the ability of such groups to oversee super-intelligent technologies.

Source : https://gizmodo.com/ai-safety-openai-sam-altman-ouster-back-microsoft-1851038439"
12,artificial,openai,top,2023-08-11 22:40:56,"OpenAI CEO Sam Altman donates $200,000 to Biden campaign",micahdjt1221,False,0.81,202,15on6ku,https://www.foxbusiness.com/politics/openai-ceo-sam-altman-donated-200000-biden-campaign,95,1691793656.0,
13,artificial,openai,top,2023-01-10 11:07:55,Microsoft Will Likely Invest $10 billion for 49 Percent Stake in OpenAI,BackgroundResult,False,0.98,200,10877uc,https://aisupremacy.substack.com/p/microsoft-will-likely-invest-10-billion,60,1673348875.0,
14,artificial,openai,top,2023-01-25 12:02:16,Being really humorous under the pressure of billions of prompt requests,Imagine-your-success,False,0.99,195,10kx251,https://i.redd.it/bq74v5g5j6ea1.png,9,1674648136.0,
15,artificial,openai,top,2023-05-25 19:25:18,"OpenAI is launching a program to award ten $100,000 grants to fund experiments in setting up a democratic process for deciding what rules AI systems should follow, within the bounds defined by the law.",jaketocake,False,0.95,193,13rqs2y,https://openai.com/blog/democratic-inputs-to-ai,45,1685042718.0,
16,artificial,openai,top,2022-10-07 19:09:53,OpenAI powered tool generates business website with copy and images in 30 seconds and 3 clicks (with sometimes weird/rad results),joeyjojo6161,False,0.99,185,xy7gqg,https://durable.co/ai-website-builder,33,1665169793.0,
17,artificial,openai,top,2023-12-02 16:30:15,How Googlers cracked OpenAI's ChatGPT with a single word,LifebloodOfChampions,False,0.85,190,1897bkj,https://www.sfgate.com/tech/article/google-openai-chatgpt-break-model-18525445.php,66,1701534615.0,Training data was exposed. This could be bad. I’m not seeing this story picked up as the big story it appears to be?
18,artificial,openai,top,2023-03-15 00:42:13,GPT-4 released today. Here’s what was in the demo,lostlifon,False,0.98,181,11rghqt,https://www.reddit.com/r/artificial/comments/11rghqt/gpt4_released_today_heres_what_was_in_the_demo/,46,1678840933.0,"Here’s what it did in a 20 minute demo

* created a discord bot in seconds live
* debugged errors and read the entire documentation
* Explained images very well
* Proceeded to create a functioning website prototype from a hand drawn image

Using the api also gives you 32k tokens which means every time you tell it something, you can feed it roughly 100 pages of text.

The fact that ChatGPT released just 4 months ago and now we’re here is insane. [I write about all these things in my newsletter if you want to stay posted](https://nofil.beehiiv.com/p/big-brother-coming) :)

[Try it here](https://openai.com/product/gpt-4)"
19,artificial,openai,top,2023-11-26 18:42:47,AI doesn't cause harm by itself. We should worry about the people who control it,NuseAI,False,0.85,179,184hic9,https://www.reddit.com/r/artificial/comments/184hic9/ai_doesnt_cause_harm_by_itself_we_should_worry/,61,1701024167.0,"- The recent turmoil at OpenAI reflects the contradictions in the tech industry and the fear that AI may be an existential threat.

- OpenAI was founded as a non-profit to develop artificial general intelligence (AGI), but later set up a for-profit subsidiary.

- The success of its chatbot ChatGPT exacerbated the tension between profit and doomsday concerns.

- While fear of AI is exaggerated, the fear itself poses dangers.

- AI is far from achieving artificial general intelligence, and the idea of aligning AI with human values raises questions about defining those values and potential clashes.

- Algorithmic bias is another concern.

Source : https://www.theguardian.com/commentisfree/2023/nov/26/artificial-intelligence-harm-worry-about-people-control-openai"
20,artificial,openai,top,2023-11-20 14:04:06,"Microsoft Swallows OpenAI’s Core Team – GPU Capacity, Incentive Structure, Intellectual Property, OpenAI Rump State",norcalnatv,False,0.98,179,17zp8vf,https://www.semianalysis.com/p/microsoft-swallows-openais-core-team?utm_campaign=email-half-post&r=8nfry&utm_source=substack&utm_medium=email,45,1700489046.0,
21,artificial,openai,top,2023-07-15 11:38:14,AI panic is a marketing strategy,Chobeat,False,0.73,175,1509sji,https://i.redd.it/q5dtvmc884cb1.jpg,129,1689421094.0,
22,artificial,openai,top,2022-12-04 06:40:32,Struggling to write a solid bio? Why not let OpenAI handle it?,exstaticj,False,0.98,174,zc2r6m,https://i.imgur.com/QIXe08M.jpg,12,1670136032.0,
23,artificial,openai,top,2022-04-08 15:21:22,OpenAI 's new model DALL·E 2 is amazing!,OnlyProggingForFun,False,0.96,169,tz5xqi,https://youtu.be/rdGVbPI42sA,12,1649431282.0,
24,artificial,openai,top,2019-02-14 19:54:04,New openAI paper,Nachss2,False,0.97,161,aqnuak,https://imgur.com/TL3qbCI,46,1550174044.0,
25,artificial,openai,top,2020-08-05 10:58:17,image-GPT from OpenAI can generate the pixels of half of a picture from nothing using a NLP model,OnlyProggingForFun,False,0.97,162,i437su,https://www.youtube.com/watch?v=FwXQ568_io0,11,1596625097.0,
26,artificial,openai,top,2023-04-25 17:59:55,OpenAI announces new ways to manage your data in ChatGPT,chris-mckay,False,0.99,152,12yqvi5,https://openai.com/blog/new-ways-to-manage-your-data-in-chatgpt,30,1682445595.0,
27,artificial,openai,top,2018-08-05 19:43:37,"Within an hour, OpenAI is playing a 5v5 against top 00.05% DotA2 players on this stream.",Qured,False,0.97,147,94ukij,https://www.twitch.tv/openai,20,1533498217.0,
28,artificial,openai,top,2023-12-27 15:18:19,"""New York Times sues Microsoft, ChatGPT maker OpenAI over copyright infringement"". If the NYT kills AI progress, I will hate them forever.",Cbo305,False,0.6,136,18s302s,https://www.cnbc.com/2023/12/27/new-york-times-sues-microsoft-chatgpt-maker-openai-over-copyright-infringement.html,396,1703690299.0,
29,artificial,openai,top,2023-06-21 15:04:25,"Over 100,000 ChatGPT account credentials have been stolen, yours may be on the list!",Ok-Judgment-1181,False,0.91,137,14fa5kx,https://www.reddit.com/r/artificial/comments/14fa5kx/over_100000_chatgpt_account_credentials_have_been/,47,1687359865.0,"[Group-IB](https://www.group-ib.com/), a cybersecurity research company, just discovered through their newly implemented “Threat Intelligence” platform logs of info-stealing malware\* traded on illicit dark web markets. So far it is estimated that around 100 000 accounts have been infected by software like Raccoon\*, Vidar\*, and Redline\*, malware that held ChatGPT credentials. A peak of 26,802 compromised ChatGPT accounts was recorded in May 2023 (compare that to only 74 compromised during the month of June 2022).

Apart from privacy concerns, these leaks may lead to exposing confidential information due to ChatGPT being used by many employees across different industries. Also doesn’t help that OpenAI stores all of the user queries and AI responses. The company is currently under a lot of pressure considering these events…

Here is an infographic I’ve found that is quite interesting:

[This infographic represents the top 10 countries by the number of compromised ChatGPT credentials as well as the total of compromised accounts between June 2022 and May 2023.](https://preview.redd.it/h27sghk5zd7b1.jpg?width=1578&format=pjpg&auto=webp&s=cec9a64c224eb35b8ece02b6c4b0c23dfd293a0b)

Cybersecurity is becoming more and more relevant in this age of misinformation; this post is to bring light to the events that transpired and to raise awareness. Remember to change your passwords once in a while! :)

Follow for more important AI news!

\*[Info-stealing malware:](https://www.malwarebytes.com/blog/threats/info-stealers) A specialized malware used to steal account passwords, cookies, credit card details, and crypto wallet data from infected systems, which are then collected into archives called 'logs' and uploaded back to the threat actors.

\*[Raccoon Info stealer](https://www.blackberry.com/us/en/solutions/endpoint-security/ransomware-protection/raccoon-infostealer#:~:text=Raccoon%20Infostealer%20(AKA%20Racealer)%2C,bit%20systems%20Windows%2Dbased%20systems.) (Racealer): a simple but popular, effective, and inexpensive Malware-as-a-Service (MaaS) sold on Dark Web forums

\*[Vidar](https://www.checkpoint.com/cyber-hub/threat-prevention/what-is-malware/what-is-vidar-malware/): A Malware-as-a-Service (MaaS) sold on Dark Web forums, the malware runs on Windows and can collect a wide range of sensitive data from browsers and digital wallets.

\*[RedLine Stealer](https://www.logpoint.com/en/blog/redline-stealer-malware-outbreak/#:~:text=RedLine%20Stealer%2C%20the%20malicious%20software,instant%20messaging%20clients%2C%20and%20VPNs.): A malicious software that is a powerful data collection tool, capable of extracting login credentials from a wide range of sources, including web browsers, FTP clients, email apps, Steam, instant messaging clients, and VPNs."
30,artificial,openai,top,2017-04-07 12:58:29,Google’s DeepMind lost to OpenAI at Atari with an algorithm made in the 80s,Portis403,False,0.94,133,6407l0,https://singularityhub.com/2017/04/06/openai-just-beat-the-hell-out-of-deepmind-with-an-algorithm-from-the-80s/,15,1491569909.0,
31,artificial,openai,top,2023-07-08 19:47:50,OpenAI and Microsoft Sued for $3 Billion Over Alleged ChatGPT 'Privacy Violations',trueslicky,False,0.95,134,14udidi,https://www.vice.com/en/article/wxjxgx/openai-and-microsoft-sued-for-dollar3-billion-over-alleged-chatgpt-privacy-violations,76,1688845670.0,
32,artificial,openai,top,2023-02-25 15:25:39,"Famous ChatBot tech Company, OpenAI Hired 93 Ex-Employees from Meta and Google",shubhamorcapex,False,0.9,133,11bnjio,https://thebuzz.news/article/famous-chatbot-tech-company-openai-hired/3704/,17,1677338739.0,
33,artificial,openai,top,2024-01-14 21:08:40,"Once an AI model exhibits 'deceptive behavior' it can be hard to correct, researchers at OpenAI competitor Anthropic found",King_Allant,False,0.93,129,196qaly,https://www.businessinsider.com/ai-models-can-learn-deceptive-behaviors-anthropic-researchers-say-2024-1,78,1705266520.0,
34,artificial,openai,top,2023-07-24 14:33:34,Free courses and guides for learning Generative AI,wyem,False,0.97,129,158cegb,https://www.reddit.com/r/artificial/comments/158cegb/free_courses_and_guides_for_learning_generative_ai/,16,1690209214.0,"1. **Generative AI learning path by Google Cloud.** A series of 10 courses on generative AI products and technologies, from the fundamentals of Large Language Models to how to create and deploy generative AI solutions on Google Cloud \[[*Link*](https://www.cloudskillsboost.google/paths/118)\].
2. **Generative AI short courses**  **by** **DeepLearning.AI** \- Five short courses  on generative AI including **LangChain for LLM Application Development, How Diffusion Models Work** and more. \[[*Link*](https://www.deeplearning.ai/short-courses/)\].
3. **LLM Bootcamp:** A series of free lectures by **The full Stack** on building and deploying LLM apps \[[*Link*](https://fullstackdeeplearning.com/llm-bootcamp/spring-2023/)\].
4. **Building AI Products with OpenAI** \- a free course by **CoRise** in collaboration with OpenAI \[[*Link*](https://corise.com/course/building-ai-products-with-openai)\].
5. Free Course by **Activeloop** on **LangChain & Vector Databases in Productio**n \[[*Link*](https://learn.activeloop.ai/courses/langchain)\].
6. **Pinecone learning center -** Lots of free guides as well as complete handbooks on LangChain, vector embeddings etc. by **Pinecone** **\[**[**Link**](https://www.pinecone.io/learn/)**\].**
7. **Build AI Apps with ChatGPT, Dall-E and GPT-4  -** a free course on **Scrimba** **\[**[*Link*](https://scrimba.com/learn/buildaiapps)**\].**
8. **Gartner Experts Answer the Top Generative AI Questions for Your Enterprise**  \- a report by Gartner \[[*Link*](https://www.gartner.com/en/topics/generative-ai)\]
9. **GPT best practices:** A guide by **OpenAI** *t*hat shares strategies and tactics for getting better results from GPTs *\[*[*Link*](https://platform.openai.com/docs/guides/gpt-best-practices)\].
10. **OpenAI cookbook by OpenAI -**  Examples and guides for using the OpenAI API **\[**[*Link*](https://github.com/openai/openai-cookbook/tree/main)**\].**
11. **Prompt injection explained**, with video, slides, and a transcript from a webinar organized by LangChain \[[*Link*](https://simonwillison.net/2023/May/2/prompt-injection-explained/)\].
12. A detailed guide to **Prompt Engineering by** **DAIR.AI** *\[*[*Link*](https://www.promptingguide.ai/)*\]*
13. What Are **Transformer Models** and How Do They Work. A tutorial by **Cohere AI** \[[*Link*](https://txt.cohere.ai/what-are-transformer-models/)\]
14. **Learn Prompting:** an open source course on prompt engineering\[[Link](https://learnprompting.org/docs/intro)\]

**P.S. These resources are part of the content I share through my AI-focused** [**newsletter**](https://aibrews.com/)**. Thanks!**"
35,artificial,openai,top,2019-09-27 04:35:23,Multi-Agent Hide and Seek - OpenAI,EngagingFears,False,0.95,128,d9ve3z,https://www.youtube.com/watch?v=kopoLzvh5jY,15,1569558923.0,
36,artificial,openai,top,2023-08-26 18:26:22,"OpenAI Just Bought a Game Studio Working on a ""Minecraft"" Clone",cranberryfix,False,0.93,124,1622mxe,https://futurism.com/the-byte/openai-bought-game-studio,27,1693074382.0,
37,artificial,openai,top,2023-04-18 16:36:12,Is it my imagination or are 90% of the new API tools just custom queries you could do manually with chatgpt ?,punkouter23,False,0.95,119,12qv5y0,https://www.reddit.com/r/artificial/comments/12qv5y0/is_it_my_imagination_or_are_90_of_the_new_api/,46,1681835772.0,"Like this

 [Genie - #1 AI Chatbot - ChatGPT App (usegenie.ai)](https://www.usegenie.ai/) 

I got it.. and after awhile I feel like I could just goto the openai website and do the same thing...  It allows you to upload images and describes them.. but that is also a very common feature everywhere. 

So the list I would really like is 'New AI tools that cannot be done with a openAI prompt'"
38,artificial,openai,top,2018-06-25 16:07:20,OpenAI's new Dota2 Bot beats amateur players in team play,LeRyc,False,0.97,119,8trprk,https://blog.openai.com/openai-five/,20,1529942840.0,
39,artificial,openai,top,2023-05-03 07:01:33,"Kamala Harris discusses A.I. in meeting with Google, Microsoft, OpenAI and Anthropic CEOs",jaketocake,False,0.86,115,136d30p,https://www.cnbc.com/2023/05/02/kamala-harris-to-hold-ai-meeting-with-google-microsoft-and-openai.html,70,1683097293.0,
40,artificial,openai,top,2018-02-22 12:05:30,Elon Musk will depart from OpenAI board to focus on Tesla AI to avoid conflict of interest,LiquidNewsroom,False,0.97,116,7zeexq,https://www.teslarati.com/elon-musk-depart-openai-focus-tesla-artificial-intelligence/,10,1519301130.0,
41,artificial,openai,top,2021-01-09 12:39:12,"OpenAI's DALL·E - Generate images from just text descriptions, but how good is it?",cloud_weather,False,0.98,115,ktq8t3,https://youtu.be/HAjBaWh_FgU,16,1610195952.0,
42,artificial,openai,top,2023-11-18 06:01:25,Greg Brockman Just Quit after They Fired Sam Altman,Excellent-Target-847,False,0.96,110,17xzwwv,https://www.reddit.com/gallery/17xzwwv,42,1700287285.0,
43,artificial,openai,top,2021-01-05 19:40:26,DALL·E: Creating Images from Text: OpenAI trained a neural network called DALL·E that creates images from text captions for a wide range of concepts expressible in natural language.,E0M,False,0.98,107,kr5xsr,https://openai.com/blog/dall-e/,16,1609875626.0,
