,id,subreddit,query,sort,date,title,author,stickied,upvote_ratio,score,url,num_comments,created,body
31,zsv5ly,OpenAI,Open-AI,comments,2022-12-22 19:53:37,"Google issues a ""code red"" in response to the rise of ChatGPT",Mk_Makanaki,False,0.98,304,https://www.reddit.com/r/OpenAI/comments/zsv5ly/google_issues_a_code_red_in_response_to_the_rise/,184,1671738817.0,"literally last week we reported Google saying for now they won’t be making anything in response to ChatGPT, citing it as a “reputational risk”. Now here we are a week later and there’s a code red, Sundar Pichai redirects some teams to focus on building out AI products and Google are scared ChatGPT will make them obsolete.

One week: WE ARE FINE  
Next Week: we are NOT fine!!!!!!!!!!!!!

Sundar Pichai, the CEO of Google's parent company, Alphabet, participated in several meetings around Google's AI strategy and has directed numerous groups in the company to refocus their efforts on addressing the threat that ChatGPT poses on its search engine business, according to an internal memo and audio recording reviewed by the Times.

In particular, teams in Google's research, Trust, and Safety division among other departments have been directed to switch gears to assist in the development and launch of new AI prototypes and products, the Times reported. Some employees have even been tasked to build AI products that generate art and graphics similar to OpenAI's DALL-E used by millions of people, according to the Times.

On one hand, this is great cause it means, AI innovation will move a lot faster cause of the competition ( capitalism at its finest)

But on the other hand, from a privacy standpoint, google will definitely not be holding back, they have more than enough data on us to train an AI FAST! so yeah we should expect some “Changes in policy”

Also not Google copying the Facebook (sorry Meta) model of Copying the startup, lmao

&#x200B;

This is from the AI With Vibes Newsletter, read the full issue here:  
[https://aiwithvibes.beehiiv.com/p/google-issues-code-red-response-rise-chatgpt](https://aiwithvibes.beehiiv.com/p/google-issues-code-red-response-rise-chatgpt)"
32,109hk0m,OpenAI,Open-AI,comments,2023-01-11 22:08:50,"Dear OpenAI, stop killing Creativity please! Not every edgy content has to be monitoring, we are grown ups and we know what we are doing, this is getting frustrating. (The state of chatGPT TODAY)",Unreal_777,False,0.87,385,https://i.redd.it/pbin8n38mhba1.png,178,1673474930.0,
33,11u1crf,OpenAI,Open-AI,comments,2023-03-17 19:36:53,"OpenAI no longer Open. ""We were wrong [...] I fully expect that in a few years it’s going to be completely obvious to everyone that open-sourcing AI is just not wise.""",Leximancer,False,0.91,155,https://www.reddit.com/r/OpenAI/comments/11u1crf/openai_no_longer_open_we_were_wrong_i_fully/,178,1679081813.0,"[Link to article](https://analyticsindiamag.com/stop-questioning-openais-open-source-policy/?utm_source=rss&utm_medium=rss&utm_campaign=stop-questioning-openais-open-source-policy).

Hmmm. I wonder if the 'obvious' part is that Microsoft invested billions of dollars and doesn't want Google to immediately beat them at their own game the way they have in browsers, OS and search in the past?"
34,13gfnpe,OpenAI,Open-AI,comments,2023-05-13 11:59:42,Yesterday I made a post about GPT4 playing Minecraft and people called it out to be fake. You can now interact with it on Twitch,dex3r,False,0.96,375,https://www.reddit.com/r/OpenAI/comments/13gfnpe/yesterday_i_made_a_post_about_gpt4_playing/,169,1683979182.0,"[https://www.twitch.tv/dex3r](https://www.twitch.tv/dex3r)

Yesterday I made a post: [I build a GPT4 bot that can play Minecraft, chop trees, build a house, and follow your commands](https://www.reddit.com/r/OpenAI/duplicates/13fmaxn/i_build_a_gpt4_bot_that_can_play_minecraft_chop/)

People called me out it's fake.

Today, you can control what GPT4 does in Minecraft by sending requests in Twitch chat. Just start your message with !

Possibilities are very limited for now, but I plan to extend its available actions to be able to beat the game.

EDIT: They (Chat and GPT4) beat the game, GG. I'm planning to add more features soon, follow on twitch to not miss out ;)"
35,134lxz5,OpenAI,Open-AI,comments,2023-05-01 13:03:45,OpenAI Community Thread - May 2023,AutoModerator,False,0.95,46,https://www.reddit.com/r/OpenAI/comments/134lxz5/openai_community_thread_may_2023/,167,1682946225.0,This is the first general monthly thread to talk all things OpenAI! Basic questions from new users to in-depth discussions from experts are both encouraged.
36,11a0lxu,OpenAI,Open-AI,comments,2023-02-23 15:37:38,"I've built a few tools on top of GPT-3.5 (text generation, q&a with embeddings). AMA about resources and AI dev stacks for building with OpenAI's APIs",TikkunCreation,False,0.98,102,https://www.reddit.com/r/OpenAI/comments/11a0lxu/ive_built_a_few_tools_on_top_of_gpt35_text/,163,1677166658.0,"Started building with GPT-3 in July 2022 and have built a few things since then.

Things I've done have involved:

* Text generation (the basic GPT function)
* Text embeddings (for search, and for similarity, and for q&a)
* Whisper (via serverless inference, and via API)
* Langchain and GPT-Index/LLama Index
* Pinecone for vector db

I don't know much, but I know infinitely more than when I started and I sure could've saved myself back then a lot of time.

So ask me anything that might save you time or wasted effort! Some suggested questions would be things about what the best tools and tutorials/examples to use for a given goal/project are, comparisons between tools/stacks. Also, go with any questions because other people from the subreddit will probably chime in too"
37,zwomkm,OpenAI,Open-AI,comments,2022-12-27 20:03:48,"OpenAI is dumbing down ChatGPT, again",Mk_Makanaki,False,0.82,225,https://www.reddit.com/r/OpenAI/comments/zwomkm/openai_is_dumbing_down_chatgpt_again/,162,1672171428.0,"In less than a month, ChatGPT went from “oh sh!t this is cool!” to “oh sh!t this is censored af!”

&#x200B;

https://preview.redd.it/xo1ufqgdyh8a1.png?width=960&format=png&auto=webp&s=f5adbf86a042faf8643b6a204f7e2a64ae8c842b

&#x200B;

In OpenAI’s bid to conform to being “politically correct,” we’ve seen an obvious and sad dumbing down of the model. From it refusing to answer any controversial question to patching any workaround like role-playing.

&#x200B;

https://preview.redd.it/khjbft9fyh8a1.png?width=1200&format=png&auto=webp&s=858e20bf19093c26ed2a7a9fa418ea9f97088a68

&#x200B;

About a week ago, you could role-play with ChatGPT and get it to say some pretty funny and interesting things. Now that the OpenAI team has patched this, people will find a new way to explore the ability of ChatGPT, does that mean they’ll patch that too?

In as much as we understand that there are bad actors, limiting the ability of ChatGPT is probably not the best way to propagate the safe use of AI. How long do we have before the whole lore of ChatGPT is patched and we just have a basic chatbot?

What do you think is the best way to both develop AI and Keep it safe?

This is from the AI With Vibes Newsletter, read the full issue here:  
[https://aiwithvibes.beehiiv.com/p/openai-dumbing-chatgpt](https://aiwithvibes.beehiiv.com/p/openai-dumbing-chatgpt)"
38,13afprt,OpenAI,Open-AI,comments,2023-05-07 06:55:28,"GPT Program To Rewrite Ebooks and 5,000+ Word Articles",The-Intelligent-One,False,0.88,291,https://www.reddit.com/r/OpenAI/comments/13afprt/gpt_program_to_rewrite_ebooks_and_5000_word/,158,1683442528.0,"I have created 2 programs, that together allow you to bypass the Open AI character limit on prompts by breaking PDF or word documents into smaller fragments, then creating a framework of chapters to structure a book and then creating a book based off the chapter framework provided.   


Allowing you to turn a 10,000 word ebook into a plagiarism free, original ebook within 15 minutes.  


Chapter Framework Builder - [https://github.com/Jenner-Brandon/GTP-BookFramework](https://github.com/Jenner-Brandon/GTP-BookFramework)  


Ebook Rewriter - [https://github.com/Jenner-Brandon/GTP-Reworder](https://github.com/Jenner-Brandon/GTP-Reworder)"
39,10cfa5i,OpenAI,Open-AI,comments,2023-01-15 09:06:35,Satya Nadella supremacy,Notalabel_4566,False,0.96,1166,https://i.imgur.com/RCVYz7N.jpg,156,1673773595.0,
40,12jyes5,OpenAI,Open-AI,comments,2023-04-12 20:41:30,What are good techniques for feeding extremely large documents (1000+ pages) into ChatGPT?,somethingstrang,False,0.99,355,https://www.reddit.com/r/OpenAI/comments/12jyes5/what_are_good_techniques_for_feeding_extremely/,155,1681332090.0,"I have a use case where I have an extremely large document, let's say 1000+ pages of text (PDF).

I want to be able to search for information by asking ChatGPT to read through the entire corpus and locating that information for me.

Some challenges I see are:

1. ChatGPT / GPT4 have a character limit
2. Prompt splitting could work, but I worry that ChatGPT may not have enough memory to remember very early information that could provide the necessary context for later information downstream.
3. It is expensive and time consuming to go through each section one by one after text splitting.

Is there an intelligent way to achieve this with efficiency and scale? Perhaps one way is to use an in-house cheaper and faster LLM to do rough searching and bubble up candidates, and then ask ChatGPT to do the last mile?

&#x200B;

&#x200B;

EDIT: Thanks guys - lots of good suggestions here. Copy pasting some of the info that caught my attention:

LangChain – framework for scalable Generative AI applications- [https://www.pinecone.io/learn/langchain-intro/](https://www.pinecone.io/learn/langchain-intro/)

PineCone – Vector database - [https://www.pinecone.io/](https://www.pinecone.io/)

Weviate – another vector database - [https://weaviate.io/](https://weaviate.io/)

What are embeddings?: [https://platform.openai.com/docs/guides/embeddings/what-are-embeddings](https://platform.openai.com/docs/guides/embeddings/what-are-embeddings)

Building Q&A system on data tutorial: [https://platform.openai.com/docs/tutorials/web-qa-embeddings](https://platform.openai.com/docs/tutorials/web-qa-embeddings)

Another tutorial: [https://github.com/openai/openai-cookbook/blob/main/examples/Question\_answering\_using\_embeddings.ipynb](https://github.com/openai/openai-cookbook/blob/main/examples/Question_answering_using_embeddings.ipynb)

Youtube Tutorial on 300-page PDF with LangChain and OpenAI: [https://www.youtube.com/watch?v=h0DHDp1FbmQ](https://www.youtube.com/watch?v=h0DHDp1FbmQ)

Combining all the techniques in one open-source library: [https://github.com/mayooear/gpt4-pdf-chatbot-langchain](https://github.com/mayooear/gpt4-pdf-chatbot-langchain)

&#x200B;

The steps are (can be supported via LangChain framework):

1.	Turn the document into embeddings (maybe using Ada)

2.	Store those embeddings in a vector db (like pinecone)

3.	When user makes a question, use Ada to turn their question into embeddings

4.	Use those embeddings to search the vector db (via cosine similarity)

5.	Return all the relevant strings from the vector db

6.	Construct a prompt gpt 3-4 to answer the original user question using info contained in the returned strings from the vector db

7.	Send result to user

&#x200B;"
41,znsw56,OpenAI,Open-AI,comments,2022-12-16 23:54:49,OpenAI brought tears to my eyes - it will revolutionize healthcare.,rampetroll,False,0.96,513,https://www.reddit.com/r/OpenAI/comments/znsw56/openai_brought_tears_to_my_eyes_it_will/,149,1671234889.0,"I am a medical student with three years of ICU experience, and now currently at an orthopedic surgery unit. Last week, I randomly discovered OpenAI Playground, and this is my experience:

At first, I was not sure what it was all about, but when I finally understood how to use it and how to ""correctly"" ask certain questions, the results it generated, was interesting.

To put it up for a true test, I gave it some data about an extremely complex ICU-patient. I gave it information about the patients gender, age, weight, and a short summary of that persons anamnesis. I further gave it information about the ventilators settings (percentage of oxygen, flow, PEEP etc), and a list of medicine. Based on all the data given, I asked it to create an opinion on the treatment, what the outcome could look like, what we should be aware of, and eventually a suggestion on what to do next. I gave it one question at a time, but based on the same data.

The results it generated, were overwhelming. I literally started to cry, realizing how that very moment could change our lives forever. It was a truly life changing experience. It generated beautiful text, easy to understand and completely up to date with our latest protocols and knowledge within our medical field. The treatment strategy it generated was like taken straight out of my senior physicians notes. This machine did not come up with a standard protocol for a typical patient in a similar situation. It literally decided on the different variables, and made a treatment plan based on it.

I was thinking about how useful this can be as a tool for doctors, physicians, nurses, physical therapists, and the list goes on and on. This technology will help us make more precise diagnosis, and suggest the best treatment strategy based on what information and data we provide it. This technology will save lives and optimize/increase the patients outcome and quality of life after a longer stay at hospitals. And this again will save money. It is a win win situation, if used correctly. A true game changer.

I do not believe AI will make us more stupid. This has done the complete opposite for me. It has expanded my brain and given me new ideas. It has helped me to understand things in more simple ways, things that I have spent years trying to wrap my brain around.

I am still shaking a bit after my experience with OpenAI Playground. And this is only the start. Imagine what it can do for us in 5 years. As a future doctor who wants to specialize in ICU and trauma, this tool is very welcome.

Edit: typo"
42,1214pf6,OpenAI,Open-AI,comments,2023-03-25 00:35:17,AI Advancements and the Need for Universal Basic Income: A Timely Debate,Pretty-Technologies,False,0.85,99,https://www.reddit.com/r/OpenAI/comments/1214pf6/ai_advancements_and_the_need_for_universal_basic/,147,1679704517.0,"As artificial intelligence (AI) continues to make extraordinary advancements, it's becoming increasingly apparent that its impact on the job market is profound. Many people now face the risk of losing their jobs to AI-powered automation, which raises important questions about the future of work and financial security.

With this in mind, is it time to seriously consider the concept of a universal basic income (UBI) or citizen's salary as a potential solution? A UBI would guarantee a minimum income for every individual, regardless of their employment status, which could alleviate financial stress and promote a more equitable society.

Some proponents argue that a UBI could foster a sense of freedom and creativity, allowing people to pursue their passions and contribute to society in more meaningful ways. Critics, on the other hand, contend that it could lead to a lack of motivation and discourage people from seeking work.

As we continue to navigate the ever-evolving landscape of AI and automation, it's crucial that we engage in thoughtful discussions about the merits and drawbacks of a UBI. This debate is more relevant than ever, as it will help us determine the best course of action to secure a prosperous future for all.

Let's open up the conversation: What are your thoughts on the implementation of a universal basic income in response to AI-driven job displacement?"
43,zlzcm2,OpenAI,Open-AI,comments,2022-12-14 19:05:29,OpenAI is developing a watermark to identify work from its GPT text AI,Mk_Makanaki,False,0.91,148,https://www.reddit.com/r/OpenAI/comments/zlzcm2/openai_is_developing_a_watermark_to_identify_work/,139,1671044729.0,"OpenAI is working on a tool to watermark AI-generated text to prevent misuse. The watermark uses a cryptographic pseudorandom function to add an unnoticeable signal to the text.

Look crypto bros, **CRYPTOgraphy** lets spam Twitter with this as a Use case (sarcasm)

In basic terms: Open AI is adding a watermark to text generated from GPT, so it's easier to spot AI-generated works.

The watermark-like security feature could help teachers and academics spot students who are using text generators such as OpenAI’s GPT to write essays for them, but cryptography experts say workarounds will inevitably be found.

*not AI toying with students’ emotions 😭*

But on a more serious note, it's inevitable that a workaround will be created, this one should also be a nice battle between AI developers and People who want to use uncredited work ( I think they are called pirates??? i don’t know).

What do you think about this?

This is from the AI With Vibes Newsletter, read the full issue here: [https://aiwithvibes.beehiiv.com/p/ai-chatbot-can-negotiate-bills-google-wont-launch-chatgpt-rival](https://aiwithvibes.beehiiv.com/p/ai-chatbot-can-negotiate-bills-google-wont-launch-chatgpt-rival)"
44,12w7zba,OpenAI,Open-AI,comments,2023-04-23 13:04:59,I made an open source tool that will turn you into a content powerhouse,CyberPunkMetalHead,False,0.74,155,https://www.reddit.com/r/OpenAI/comments/12w7zba/i_made_an_open_source_tool_that_will_turn_you/,139,1682255099.0," If SEO or content writing is a priority for you, well buckle up because this little tool I made is about to blow your mind.

It almost seems that there’s a new GPT-driven paradigm shift almost every day now, and that people continue to find new and amazing applications for large language models, but they are not without limitations. When it comes to article writing, ChatGPT tends to spit out generic sounding articles that no human with a working cortex would enjoy reading, or find much value in them. However, giving it an article as an input and asking it to re-write it and focus on a certain angle or perspective, will produce really good results!

And that’s the core idea behind this little tool I made. With it, you can scrape entire blogs or knowledgebases and programmatically give each article to chatGPT to re-write.

The beauty is that you can tell ChatGPT to focus on a certain angle, or re-write the entire article from a a different perspective. You can also tell it to focus on certain keywords, and the end result will be a high quality, SEO-optimised unique piece of content.

You can generate hundreds of articles like this and all you need is an OpenAI API key and to run the script on your machine.

If this sounds like something that's helpful to you, here is the [Github repository](https://github.com/CyberPunkMetalHead/seo-gpt) for it that should contain all the instructions on how to get it set up and running.

If you need more help setting it up, check out the [guide](https://cryptomaton.medium.com/seogpt-the-only-content-generating-tool-youll-ever-need-1560d8dcdf36?sk=9d1f47e97a1898e6a86f2672ffaaf907) I wrote about it.

That's about it. I thought some of you might find this useful so I just wanted to share it with you :)."
45,109wgdy,OpenAI,Open-AI,comments,2023-01-12 10:29:00,"I spent 2 weeks straight making ChatGPT write a version of itself for public use. You can use it right now at www.freegpt.me, a completely free version with less restrictions.",PSKTS_Heisingberg,False,0.94,541,https://www.reddit.com/gallery/109wgdy,132,1673519340.0,
46,12or57c,OpenAI,Open-AI,relevance,2023-04-16 22:16:13,"Elon Musk quietly starts X.AI, a new artificial intelligence company to challenge OpenAI",Collective1985,False,0.86,239,https://venturebeat.com/ai/elon-musk-quietly-starts-x-ai-a-new-artificial-intelligence-company-to-challenge-openai/,193,1681683373.0,
47,13bazla,OpenAI,Open-AI,relevance,2023-05-08 02:25:31,Why is open ai so optimistic?,lifeoflaurels,False,0.89,139,https://www.reddit.com/r/OpenAI/comments/13bazla/why_is_open_ai_so_optimistic/,115,1683512731.0,"I've been playing around with the open ai making it write stories, sonnets, ballads, all with depressing themes. The only thing is, every single freaking one has a super optimistic ending. It even wrote a story of a guy who's whole family dies then he off himself leaving everything he owns to charity,  and spun that into how he made the world a better place with ""his kind heart even in the end""

Why is this a thing? Why is it programmed this way? It can't even write a poem about heartbreak that still ends with hearbreak"
48,zwomkm,OpenAI,Open-AI,relevance,2022-12-27 20:03:48,"OpenAI is dumbing down ChatGPT, again",Mk_Makanaki,False,0.82,226,https://www.reddit.com/r/OpenAI/comments/zwomkm/openai_is_dumbing_down_chatgpt_again/,162,1672171428.0,"In less than a month, ChatGPT went from “oh sh!t this is cool!” to “oh sh!t this is censored af!”

&#x200B;

https://preview.redd.it/xo1ufqgdyh8a1.png?width=960&format=png&auto=webp&s=f5adbf86a042faf8643b6a204f7e2a64ae8c842b

&#x200B;

In OpenAI’s bid to conform to being “politically correct,” we’ve seen an obvious and sad dumbing down of the model. From it refusing to answer any controversial question to patching any workaround like role-playing.

&#x200B;

https://preview.redd.it/khjbft9fyh8a1.png?width=1200&format=png&auto=webp&s=858e20bf19093c26ed2a7a9fa418ea9f97088a68

&#x200B;

About a week ago, you could role-play with ChatGPT and get it to say some pretty funny and interesting things. Now that the OpenAI team has patched this, people will find a new way to explore the ability of ChatGPT, does that mean they’ll patch that too?

In as much as we understand that there are bad actors, limiting the ability of ChatGPT is probably not the best way to propagate the safe use of AI. How long do we have before the whole lore of ChatGPT is patched and we just have a basic chatbot?

What do you think is the best way to both develop AI and Keep it safe?

This is from the AI With Vibes Newsletter, read the full issue here:  
[https://aiwithvibes.beehiiv.com/p/openai-dumbing-chatgpt](https://aiwithvibes.beehiiv.com/p/openai-dumbing-chatgpt)"
49,134lxz5,OpenAI,Open-AI,relevance,2023-05-01 13:03:45,OpenAI Community Thread - May 2023,AutoModerator,False,0.94,46,https://www.reddit.com/r/OpenAI/comments/134lxz5/openai_community_thread_may_2023/,167,1682946225.0,This is the first general monthly thread to talk all things OpenAI! Basic questions from new users to in-depth discussions from experts are both encouraged.
50,znsw56,OpenAI,Open-AI,relevance,2022-12-16 23:54:49,OpenAI brought tears to my eyes - it will revolutionize healthcare.,rampetroll,False,0.96,514,https://www.reddit.com/r/OpenAI/comments/znsw56/openai_brought_tears_to_my_eyes_it_will/,149,1671234889.0,"I am a medical student with three years of ICU experience, and now currently at an orthopedic surgery unit. Last week, I randomly discovered OpenAI Playground, and this is my experience:

At first, I was not sure what it was all about, but when I finally understood how to use it and how to ""correctly"" ask certain questions, the results it generated, was interesting.

To put it up for a true test, I gave it some data about an extremely complex ICU-patient. I gave it information about the patients gender, age, weight, and a short summary of that persons anamnesis. I further gave it information about the ventilators settings (percentage of oxygen, flow, PEEP etc), and a list of medicine. Based on all the data given, I asked it to create an opinion on the treatment, what the outcome could look like, what we should be aware of, and eventually a suggestion on what to do next. I gave it one question at a time, but based on the same data.

The results it generated, were overwhelming. I literally started to cry, realizing how that very moment could change our lives forever. It was a truly life changing experience. It generated beautiful text, easy to understand and completely up to date with our latest protocols and knowledge within our medical field. The treatment strategy it generated was like taken straight out of my senior physicians notes. This machine did not come up with a standard protocol for a typical patient in a similar situation. It literally decided on the different variables, and made a treatment plan based on it.

I was thinking about how useful this can be as a tool for doctors, physicians, nurses, physical therapists, and the list goes on and on. This technology will help us make more precise diagnosis, and suggest the best treatment strategy based on what information and data we provide it. This technology will save lives and optimize/increase the patients outcome and quality of life after a longer stay at hospitals. And this again will save money. It is a win win situation, if used correctly. A true game changer.

I do not believe AI will make us more stupid. This has done the complete opposite for me. It has expanded my brain and given me new ideas. It has helped me to understand things in more simple ways, things that I have spent years trying to wrap my brain around.

I am still shaking a bit after my experience with OpenAI Playground. And this is only the start. Imagine what it can do for us in 5 years. As a future doctor who wants to specialize in ICU and trauma, this tool is very welcome.

Edit: typo"
