,id,subreddit,query,sort,date,title,author,stickied,upvote_ratio,score,url,num_comments,created,body
51,zlzcm2,OpenAI,Open-AI,relevance,2022-12-14 19:05:29,OpenAI is developing a watermark to identify work from its GPT text AI,Mk_Makanaki,False,0.91,149,https://www.reddit.com/r/OpenAI/comments/zlzcm2/openai_is_developing_a_watermark_to_identify_work/,139,1671044729.0,"OpenAI is working on a tool to watermark AI-generated text to prevent misuse. The watermark uses a cryptographic pseudorandom function to add an unnoticeable signal to the text.

Look crypto bros, **CRYPTOgraphy** lets spam Twitter with this as a Use case (sarcasm)

In basic terms: Open AI is adding a watermark to text generated from GPT, so it's easier to spot AI-generated works.

The watermark-like security feature could help teachers and academics spot students who are using text generators such as OpenAI’s GPT to write essays for them, but cryptography experts say workarounds will inevitably be found.

*not AI toying with students’ emotions 😭*

But on a more serious note, it's inevitable that a workaround will be created, this one should also be a nice battle between AI developers and People who want to use uncredited work ( I think they are called pirates??? i don’t know).

What do you think about this?

This is from the AI With Vibes Newsletter, read the full issue here: [https://aiwithvibes.beehiiv.com/p/ai-chatbot-can-negotiate-bills-google-wont-launch-chatgpt-rival](https://aiwithvibes.beehiiv.com/p/ai-chatbot-can-negotiate-bills-google-wont-launch-chatgpt-rival)"
52,11u1crf,OpenAI,Open-AI,relevance,2023-03-17 19:36:53,"OpenAI no longer Open. ""We were wrong [...] I fully expect that in a few years it’s going to be completely obvious to everyone that open-sourcing AI is just not wise.""",Leximancer,False,0.91,156,https://www.reddit.com/r/OpenAI/comments/11u1crf/openai_no_longer_open_we_were_wrong_i_fully/,178,1679081813.0,"[Link to article](https://analyticsindiamag.com/stop-questioning-openais-open-source-policy/?utm_source=rss&utm_medium=rss&utm_campaign=stop-questioning-openais-open-source-policy).

Hmmm. I wonder if the 'obvious' part is that Microsoft invested billions of dollars and doesn't want Google to immediately beat them at their own game the way they have in browsers, OS and search in the past?"
